===GPU Info===
Thu Apr 24 23:06:00 2025       
+---------------------------------------------------------------------------------------+
| NVIDIA-SMI 545.23.08              Driver Version: 545.23.08    CUDA Version: 12.3     |
|-----------------------------------------+----------------------+----------------------+
| GPU  Name                 Persistence-M | Bus-Id        Disp.A | Volatile Uncorr. ECC |
| Fan  Temp   Perf          Pwr:Usage/Cap |         Memory-Usage | GPU-Util  Compute M. |
|                                         |                      |               MIG M. |
|=========================================+======================+======================|
|   0  NVIDIA A100-PCIE-40GB          Off | 00000000:01:00.0 Off |                  Off |
| N/A   45C    P0              44W / 250W |      4MiB / 40960MiB |     37%      Default |
|                                         |                      |             Disabled |
+-----------------------------------------+----------------------+----------------------+
                                                                                         
+---------------------------------------------------------------------------------------+
| Processes:                                                                            |
|  GPU   GI   CI        PID   Type   Process name                            GPU Memory |
|        ID   ID                                                             Usage      |
|=======================================================================================|
|  No running processes found                                                           |
+---------------------------------------------------------------------------------------+
1.10.2+cu113
True
=== GPU Stat===
n3071-004                 Thu Apr 24 23:06:08 2025  545.23.08
[0] NVIDIA A100-PCIE-40GB | 44°C,  37 % |     4 / 40960 MB |
>>>>>>>>>>>>>>>>>>>>>>>>>>>>init param>>>>>>>>>>>>>>>>>>>>>>>>>>>>>>>>>
model_lr 0.0003
prompt_lr 0.001
prompt_sparse_rate 0.0001
ema_rate 0.999
seed 42
scale 0.1
>>>>>>>>>>>>>>>>>>>>>>>>>>>>over param>>>>>>>>>>>>>>>>>>>>>>>>>>>>>>>>>
Config (path: local_configs/segformer/B5/segformer.b5.1024x1024.acdc.160k_p.py): {'norm_cfg': {'type': 'SyncBN', 'requires_grad': True}, 'find_unused_parameters': True, 'model': {'type': 'EncoderDecoder', 'pretrained': None, 'backbone': {'type': 'mit_b5_prompt', 'style': 'pytorch', 'prompt_psize': 20, 'prompt_np_row': 4, 'prompt_sparse_rate': 0.25}, 'decode_head': {'type': 'SegFormerHead', 'in_channels': [64, 128, 320, 512], 'in_index': [0, 1, 2, 3], 'feature_strides': [4, 8, 16, 32], 'channels': 128, 'dropout_ratio': 0.1, 'num_classes': 19, 'norm_cfg': {'type': 'SyncBN', 'requires_grad': True}, 'align_corners': False, 'decoder_params': {'embed_dim': 768}, 'loss_decode': {'type': 'CrossEntropyLoss', 'use_sigmoid': False, 'loss_weight': 1.0, 'reduction': 'none'}}, 'train_cfg': {}, 'test_cfg': {'mode': 'slide', 'crop_size': (1024, 1024), 'stride': (768, 768)}}, 'dataset_type': 'ACDCDataset', 'data_root': '/gpfs/data/fs72306/leijx0408/SVDP/dataset', 'img_norm_cfg': {'mean': [123.675, 116.28, 103.53], 'std': [58.395, 57.12, 57.375], 'to_rgb': True}, 'crop_size': (224, 224), 'train_pipeline': [{'type': 'LoadImageFromFile'}, {'type': 'LoadAnnotations'}, {'type': 'Resize', 'img_scale': (1920, 1080), 'ratio_range': (0.5, 2.0)}, {'type': 'RandomCrop', 'crop_size': (1024, 1024), 'cat_max_ratio': 0.75}, {'type': 'RandomFlip', 'prob': 0.5}, {'type': 'PhotoMetricDistortion'}, {'type': 'Normalize', 'mean': [123.675, 116.28, 103.53], 'std': [58.395, 57.12, 57.375], 'to_rgb': True}, {'type': 'Pad', 'size': (1024, 1024), 'pad_val': 0, 'seg_pad_val': 255}, {'type': 'DefaultFormatBundle'}, {'type': 'Collect', 'keys': ['img', 'gt_semantic_seg']}], 'test_pipeline': [{'type': 'LoadImageFromFile'}, {'type': 'MultiScaleFlipAug', 'img_scale': (960, 540), 'flip': False, 'transforms': [{'type': 'Resize', 'keep_ratio': True}, {'type': 'RandomFlip'}, {'type': 'Normalize', 'mean': [123.675, 116.28, 103.53], 'std': [58.395, 57.12, 57.375], 'to_rgb': True}, {'type': 'ImageToTensor', 'keys': ['img']}, {'type': 'Collect', 'keys': ['img']}]}], 'data': {'samples_per_gpu': 2, 'workers_per_gpu': 2, 'train': {'type': 'RepeatDataset', 'times': 500, 'dataset': {'type': 'ACDCDataset', 'data_root': '/gpfs/data/fs72306/leijx0408/SVDP/dataset', 'img_dir': 'leftImg8bit/train', 'ann_dir': 'gtFine/train', 'pipeline': [{'type': 'LoadImageFromFile'}, {'type': 'LoadAnnotations'}, {'type': 'Resize', 'img_scale': (1920, 1080), 'ratio_range': (0.5, 2.0)}, {'type': 'RandomCrop', 'crop_size': (1024, 1024), 'cat_max_ratio': 0.75}, {'type': 'RandomFlip', 'prob': 0.5}, {'type': 'PhotoMetricDistortion'}, {'type': 'Normalize', 'mean': [123.675, 116.28, 103.53], 'std': [58.395, 57.12, 57.375], 'to_rgb': True}, {'type': 'Pad', 'size': (1024, 1024), 'pad_val': 0, 'seg_pad_val': 255}, {'type': 'DefaultFormatBundle'}, {'type': 'Collect', 'keys': ['img', 'gt_semantic_seg']}]}}, 'val': {'type': 'ACDCDataset', 'data_root': '/gpfs/data/fs72306/leijx0408/SVDP/dataset', 'img_dir': 'rgb_anon/fog/train', 'ann_dir': 'gt/fog/train', 'pipeline': [{'type': 'LoadImageFromFile'}, {'type': 'MultiScaleFlipAug', 'img_scale': (960, 540), 'flip': False, 'transforms': [{'type': 'Resize', 'keep_ratio': True}, {'type': 'RandomFlip'}, {'type': 'Normalize', 'mean': [123.675, 116.28, 103.53], 'std': [58.395, 57.12, 57.375], 'to_rgb': True}, {'type': 'ImageToTensor', 'keys': ['img']}, {'type': 'Collect', 'keys': ['img']}]}]}, 'test': {'type': 'ACDCDataset', 'data_root': '/gpfs/data/fs72306/leijx0408/SVDP/dataset', 'img_dir': 'rgb_anon/fog/train', 'ann_dir': 'gt/fog/train', 'pipeline': [{'type': 'LoadImageFromFile'}, {'type': 'MultiScaleFlipAug', 'img_scale': (960, 540), 'flip': True, 'transforms': [{'type': 'Resize', 'keep_ratio': True}, {'type': 'RandomFlip'}, {'type': 'Normalize', 'mean': [123.675, 116.28, 103.53], 'std': [58.395, 57.12, 57.375], 'to_rgb': True}, {'type': 'ImageToTensor', 'keys': ['img']}, {'type': 'Collect', 'keys': ['img']}], 'img_ratios': [0.5, 0.75, 1.0, 1.25, 1.5, 1.75, 2.0]}], 'test_mode': True}, 'test1': {'type': 'ACDCDataset', 'data_root': '/gpfs/data/fs72306/leijx0408/SVDP/dataset', 'img_dir': 'rgb_anon/night/train', 'ann_dir': 'gt/night/train', 'pipeline': [{'type': 'LoadImageFromFile'}, {'type': 'MultiScaleFlipAug', 'img_scale': (960, 540), 'flip': True, 'transforms': [{'type': 'Resize', 'keep_ratio': True}, {'type': 'RandomFlip'}, {'type': 'Normalize', 'mean': [123.675, 116.28, 103.53], 'std': [58.395, 57.12, 57.375], 'to_rgb': True}, {'type': 'ImageToTensor', 'keys': ['img']}, {'type': 'Collect', 'keys': ['img']}], 'img_ratios': [0.5, 0.75, 1.0, 1.25, 1.5, 1.75, 2.0]}]}, 'test2': {'type': 'ACDCDataset', 'data_root': '/gpfs/data/fs72306/leijx0408/SVDP/dataset', 'img_dir': 'rgb_anon/rain/train', 'ann_dir': 'gt/rain/train', 'pipeline': [{'type': 'LoadImageFromFile'}, {'type': 'MultiScaleFlipAug', 'img_scale': (960, 540), 'flip': True, 'transforms': [{'type': 'Resize', 'keep_ratio': True}, {'type': 'RandomFlip'}, {'type': 'Normalize', 'mean': [123.675, 116.28, 103.53], 'std': [58.395, 57.12, 57.375], 'to_rgb': True}, {'type': 'ImageToTensor', 'keys': ['img']}, {'type': 'Collect', 'keys': ['img']}], 'img_ratios': [0.5, 0.75, 1.0, 1.25, 1.5, 1.75, 2.0]}]}, 'test3': {'type': 'ACDCDataset', 'data_root': '/gpfs/data/fs72306/leijx0408/SVDP/dataset', 'img_dir': 'rgb_anon/snow/train', 'ann_dir': 'gt/snow/train', 'pipeline': [{'type': 'LoadImageFromFile'}, {'type': 'MultiScaleFlipAug', 'img_scale': (960, 540), 'flip': True, 'transforms': [{'type': 'Resize', 'keep_ratio': True}, {'type': 'RandomFlip'}, {'type': 'Normalize', 'mean': [123.675, 116.28, 103.53], 'std': [58.395, 57.12, 57.375], 'to_rgb': True}, {'type': 'ImageToTensor', 'keys': ['img']}, {'type': 'Collect', 'keys': ['img']}], 'img_ratios': [0.5, 0.75, 1.0, 1.25, 1.5, 1.75, 2.0]}]}}, 'log_config': {'interval': 50, 'hooks': [{'type': 'TextLoggerHook', 'by_epoch': False}]}, 'dist_params': {'backend': 'nccl'}, 'log_level': 'INFO', 'load_from': None, 'resume_from': None, 'workflow': [('train', 1)], 'cudnn_benchmark': True, 'optimizer': {'type': 'AdamW', 'lr': 0.0001, 'betas': (0.9, 0.999), 'weight_decay': 0.01, 'paramwise_cfg': {'custom_keys': {'pos_block': {'decay_mult': 0.0}, 'norm': {'decay_mult': 0.0}, 'head': {'lr_mult': 10.0}}}}, 'optimizer_config': {}, 'lr_config': {'policy': 'poly', 'warmup': 'linear', 'warmup_iters': 1500, 'warmup_ratio': 1e-06, 'power': 1.0, 'min_lr': 0.0, 'by_epoch': False}, 'runner': {'type': 'IterBasedRunner', 'max_iters': 160000}, 'checkpoint_config': {'by_epoch': False, 'interval': 4000}, 'evaluation': {'interval': 4000, 'metric': 'mIoU'}}
>>>>>>>>init mit_b5_sparse_prompt 0.0001
load checkpoint from local path: /gpfs/data/fs72306/leijx0408/SVDP/segformer.b5.1024x1024.city.160k.pth
The model and loaded state dict do not match exactly

missing keys in source state_dict: backbone.prompt.patch, backbone.prompt.feature_prompts.0

revisiting 0
>>>>>>>>init mit_b5_sparse_prompt 0.0001
load checkpoint from local path: /gpfs/data/fs72306/leijx0408/SVDP/segformer.b5.1024x1024.city.160k.pth
The model and loaded state dict do not match exactly

missing keys in source state_dict: backbone.prompt.patch, backbone.prompt.feature_prompts.0

[                                                  ] 0/400, elapsed: 0s, ETA:[                                 ] 1/400, 0.2 task/s, elapsed: 6s, ETA:  2324s[                                 ] 2/400, 0.2 task/s, elapsed: 9s, ETA:  1881s[                                ] 3/400, 0.2 task/s, elapsed: 13s, ETA:  1723s[                                ] 4/400, 0.2 task/s, elapsed: 17s, ETA:  1644s[                                ] 5/400, 0.2 task/s, elapsed: 20s, ETA:  1594s[                                ] 6/400, 0.3 task/s, elapsed: 24s, ETA:  1560s[                                ] 7/400, 0.3 task/s, elapsed: 27s, ETA:  1534s[                                ] 8/400, 0.3 task/s, elapsed: 31s, ETA:  1514s[                                ] 9/400, 0.3 task/s, elapsed: 34s, ETA:  1498s[                               ] 10/400, 0.3 task/s, elapsed: 38s, ETA:  1484s[                               ] 11/400, 0.3 task/s, elapsed: 42s, ETA:  1472s[                               ] 12/400, 0.3 task/s, elapsed: 45s, ETA:  1462s[>                              ] 13/400, 0.3 task/s, elapsed: 49s, ETA:  1453s[>                              ] 14/400, 0.3 task/s, elapsed: 52s, ETA:  1445s[>                              ] 15/400, 0.3 task/s, elapsed: 56s, ETA:  1437s[>                              ] 16/400, 0.3 task/s, elapsed: 60s, ETA:  1430s[>                              ] 17/400, 0.3 task/s, elapsed: 63s, ETA:  1424s[>                              ] 18/400, 0.3 task/s, elapsed: 67s, ETA:  1417s[>                              ] 19/400, 0.3 task/s, elapsed: 70s, ETA:  1411s[>                              ] 20/400, 0.3 task/s, elapsed: 74s, ETA:  1406s[>                              ] 21/400, 0.3 task/s, elapsed: 78s, ETA:  1400s[>                              ] 22/400, 0.3 task/s, elapsed: 81s, ETA:  1395s[>                              ] 23/400, 0.3 task/s, elapsed: 85s, ETA:  1390s[>                              ] 24/400, 0.3 task/s, elapsed: 88s, ETA:  1385s[>                              ] 25/400, 0.3 task/s, elapsed: 92s, ETA:  1381s[>>                             ] 26/400, 0.3 task/s, elapsed: 96s, ETA:  1376s[>>                             ] 27/400, 0.3 task/s, elapsed: 99s, ETA:  1371s[>>                            ] 28/400, 0.3 task/s, elapsed: 103s, ETA:  1367s[>>                            ] 29/400, 0.3 task/s, elapsed: 106s, ETA:  1362s[>>                            ] 30/400, 0.3 task/s, elapsed: 110s, ETA:  1358s[>>                            ] 31/400, 0.3 task/s, elapsed: 114s, ETA:  1354s[>>                            ] 32/400, 0.3 task/s, elapsed: 117s, ETA:  1349s[>>                            ] 33/400, 0.3 task/s, elapsed: 121s, ETA:  1345s[>>                            ] 34/400, 0.3 task/s, elapsed: 125s, ETA:  1341s[>>                            ] 35/400, 0.3 task/s, elapsed: 128s, ETA:  1337s[>>                            ] 36/400, 0.3 task/s, elapsed: 132s, ETA:  1333s[>>                            ] 37/400, 0.3 task/s, elapsed: 135s, ETA:  1329s[>>                            ] 38/400, 0.3 task/s, elapsed: 139s, ETA:  1325s[>>                            ] 39/400, 0.3 task/s, elapsed: 143s, ETA:  1321s[>>>                           ] 40/400, 0.3 task/s, elapsed: 146s, ETA:  1317s[>>>                           ] 41/400, 0.3 task/s, elapsed: 150s, ETA:  1313s[>>>                           ] 42/400, 0.3 task/s, elapsed: 154s, ETA:  1309s[>>>                           ] 43/400, 0.3 task/s, elapsed: 157s, ETA:  1305s[>>>                           ] 44/400, 0.3 task/s, elapsed: 161s, ETA:  1301s[>>>                           ] 45/400, 0.3 task/s, elapsed: 164s, ETA:  1297s[>>>                           ] 46/400, 0.3 task/s, elapsed: 168s, ETA:  1293s[>>>                           ] 47/400, 0.3 task/s, elapsed: 172s, ETA:  1289s[>>>                           ] 48/400, 0.3 task/s, elapsed: 175s, ETA:  1285s[>>>                           ] 49/400, 0.3 task/s, elapsed: 179s, ETA:  1281s[>>>                           ] 50/400, 0.3 task/s, elapsed: 182s, ETA:  1277s[>>>                           ] 51/400, 0.3 task/s, elapsed: 186s, ETA:  1274s[>>>                           ] 52/400, 0.3 task/s, elapsed: 190s, ETA:  1270s[>>>                           ] 53/400, 0.3 task/s, elapsed: 193s, ETA:  1266s[>>>>                          ] 54/400, 0.3 task/s, elapsed: 197s, ETA:  1262s[>>>>                          ] 55/400, 0.3 task/s, elapsed: 201s, ETA:  1258s[>>>>                          ] 56/400, 0.3 task/s, elapsed: 204s, ETA:  1255s[>>>>                          ] 57/400, 0.3 task/s, elapsed: 208s, ETA:  1251s[>>>>                          ] 58/400, 0.3 task/s, elapsed: 211s, ETA:  1247s[>>>>                          ] 59/400, 0.3 task/s, elapsed: 215s, ETA:  1243s[>>>>                          ] 60/400, 0.3 task/s, elapsed: 219s, ETA:  1239s[>>>>                          ] 61/400, 0.3 task/s, elapsed: 222s, ETA:  1236s[>>>>                          ] 62/400, 0.3 task/s, elapsed: 226s, ETA:  1232s[>>>>                          ] 63/400, 0.3 task/s, elapsed: 230s, ETA:  1228s[>>>>                          ] 64/400, 0.3 task/s, elapsed: 233s, ETA:  1224s[>>>>                          ] 65/400, 0.3 task/s, elapsed: 237s, ETA:  1220s[>>>>                          ] 66/400, 0.3 task/s, elapsed: 240s, ETA:  1217s[>>>>>                         ] 67/400, 0.3 task/s, elapsed: 244s, ETA:  1213s[>>>>>                         ] 68/400, 0.3 task/s, elapsed: 248s, ETA:  1209s[>>>>>                         ] 69/400, 0.3 task/s, elapsed: 251s, ETA:  1206s[>>>>>                         ] 70/400, 0.3 task/s, elapsed: 255s, ETA:  1202s[>>>>>                         ] 71/400, 0.3 task/s, elapsed: 259s, ETA:  1198s[>>>>>                         ] 72/400, 0.3 task/s, elapsed: 262s, ETA:  1194s[>>>>>                         ] 73/400, 0.3 task/s, elapsed: 266s, ETA:  1191s[>>>>>                         ] 74/400, 0.3 task/s, elapsed: 269s, ETA:  1187s[>>>>>                         ] 75/400, 0.3 task/s, elapsed: 273s, ETA:  1183s[>>>>>                         ] 76/400, 0.3 task/s, elapsed: 277s, ETA:  1180s[>>>>>                         ] 77/400, 0.3 task/s, elapsed: 280s, ETA:  1176s[>>>>>                         ] 78/400, 0.3 task/s, elapsed: 284s, ETA:  1172s[>>>>>                         ] 79/400, 0.3 task/s, elapsed: 288s, ETA:  1168s[>>>>>>                        ] 80/400, 0.3 task/s, elapsed: 291s, ETA:  1165s[>>>>>>                        ] 81/400, 0.3 task/s, elapsed: 295s, ETA:  1161s[>>>>>>                        ] 82/400, 0.3 task/s, elapsed: 298s, ETA:  1157s[>>>>>>                        ] 83/400, 0.3 task/s, elapsed: 302s, ETA:  1154s[>>>>>>                        ] 84/400, 0.3 task/s, elapsed: 306s, ETA:  1150s[>>>>>>                        ] 85/400, 0.3 task/s, elapsed: 309s, ETA:  1146s[>>>>>>                        ] 86/400, 0.3 task/s, elapsed: 313s, ETA:  1143s[>>>>>>                        ] 87/400, 0.3 task/s, elapsed: 317s, ETA:  1139s[>>>>>>                        ] 88/400, 0.3 task/s, elapsed: 320s, ETA:  1135s[>>>>>>                        ] 89/400, 0.3 task/s, elapsed: 324s, ETA:  1131s[>>>>>>                        ] 90/400, 0.3 task/s, elapsed: 327s, ETA:  1128s[>>>>>>                        ] 91/400, 0.3 task/s, elapsed: 331s, ETA:  1124s[>>>>>>                        ] 92/400, 0.3 task/s, elapsed: 335s, ETA:  1120s[>>>>>>                        ] 93/400, 0.3 task/s, elapsed: 338s, ETA:  1117s[>>>>>>>                       ] 94/400, 0.3 task/s, elapsed: 342s, ETA:  1113s[>>>>>>>                       ] 95/400, 0.3 task/s, elapsed: 346s, ETA:  1109s[>>>>>>>                       ] 96/400, 0.3 task/s, elapsed: 349s, ETA:  1106s[>>>>>>>                       ] 97/400, 0.3 task/s, elapsed: 353s, ETA:  1102s[>>>>>>>                       ] 98/400, 0.3 task/s, elapsed: 356s, ETA:  1098s[>>>>>>>                       ] 99/400, 0.3 task/s, elapsed: 360s, ETA:  1095s[>>>>>>>                      ] 100/400, 0.3 task/s, elapsed: 364s, ETA:  1091s[>>>>>>>                      ] 101/400, 0.3 task/s, elapsed: 367s, ETA:  1087s[>>>>>>>                      ] 102/400, 0.3 task/s, elapsed: 371s, ETA:  1084s[>>>>>>>                      ] 103/400, 0.3 task/s, elapsed: 374s, ETA:  1080s[>>>>>>>                      ] 104/400, 0.3 task/s, elapsed: 378s, ETA:  1076s[>>>>>>>                      ] 105/400, 0.3 task/s, elapsed: 382s, ETA:  1072s[>>>>>>>                      ] 106/400, 0.3 task/s, elapsed: 385s, ETA:  1069s[>>>>>>>                      ] 107/400, 0.3 task/s, elapsed: 389s, ETA:  1065s[>>>>>>>                      ] 108/400, 0.3 task/s, elapsed: 393s, ETA:  1062s[>>>>>>>                      ] 109/400, 0.3 task/s, elapsed: 396s, ETA:  1058s[>>>>>>>                      ] 110/400, 0.3 task/s, elapsed: 400s, ETA:  1054s[>>>>>>>>                     ] 111/400, 0.3 task/s, elapsed: 403s, ETA:  1051s[>>>>>>>>                     ] 112/400, 0.3 task/s, elapsed: 407s, ETA:  1047s[>>>>>>>>                     ] 113/400, 0.3 task/s, elapsed: 411s, ETA:  1043s[>>>>>>>>                     ] 114/400, 0.3 task/s, elapsed: 414s, ETA:  1040s[>>>>>>>>                     ] 115/400, 0.3 task/s, elapsed: 418s, ETA:  1036s[>>>>>>>>                     ] 116/400, 0.3 task/s, elapsed: 422s, ETA:  1032s[>>>>>>>>                     ] 117/400, 0.3 task/s, elapsed: 425s, ETA:  1028s[>>>>>>>>                     ] 118/400, 0.3 task/s, elapsed: 429s, ETA:  1025s[>>>>>>>>                     ] 119/400, 0.3 task/s, elapsed: 432s, ETA:  1021s[>>>>>>>>                     ] 120/400, 0.3 task/s, elapsed: 436s, ETA:  1017s[>>>>>>>>                     ] 121/400, 0.3 task/s, elapsed: 440s, ETA:  1014s[>>>>>>>>                     ] 122/400, 0.3 task/s, elapsed: 443s, ETA:  1010s[>>>>>>>>                     ] 123/400, 0.3 task/s, elapsed: 447s, ETA:  1007s[>>>>>>>>                     ] 124/400, 0.3 task/s, elapsed: 451s, ETA:  1003s[>>>>>>>>>                    ] 125/400, 0.3 task/s, elapsed: 454s, ETA:   999s[>>>>>>>>>                    ] 126/400, 0.3 task/s, elapsed: 458s, ETA:   996s[>>>>>>>>>                    ] 127/400, 0.3 task/s, elapsed: 461s, ETA:   992s[>>>>>>>>>                    ] 128/400, 0.3 task/s, elapsed: 465s, ETA:   988s[>>>>>>>>>                    ] 129/400, 0.3 task/s, elapsed: 469s, ETA:   985s[>>>>>>>>>                    ] 130/400, 0.3 task/s, elapsed: 472s, ETA:   981s[>>>>>>>>>                    ] 131/400, 0.3 task/s, elapsed: 476s, ETA:   977s[>>>>>>>>>                    ] 132/400, 0.3 task/s, elapsed: 480s, ETA:   974s[>>>>>>>>>                    ] 133/400, 0.3 task/s, elapsed: 483s, ETA:   970s[>>>>>>>>>                    ] 134/400, 0.3 task/s, elapsed: 487s, ETA:   966s[>>>>>>>>>                    ] 135/400, 0.3 task/s, elapsed: 490s, ETA:   963s[>>>>>>>>>                    ] 136/400, 0.3 task/s, elapsed: 494s, ETA:   959s[>>>>>>>>>                    ] 137/400, 0.3 task/s, elapsed: 498s, ETA:   955s[>>>>>>>>>>                   ] 138/400, 0.3 task/s, elapsed: 501s, ETA:   952s[>>>>>>>>>>                   ] 139/400, 0.3 task/s, elapsed: 505s, ETA:   948s[>>>>>>>>>>                   ] 140/400, 0.3 task/s, elapsed: 509s, ETA:   944s[>>>>>>>>>>                   ] 141/400, 0.3 task/s, elapsed: 512s, ETA:   941s[>>>>>>>>>>                   ] 142/400, 0.3 task/s, elapsed: 516s, ETA:   937s[>>>>>>>>>>                   ] 143/400, 0.3 task/s, elapsed: 519s, ETA:   933s[>>>>>>>>>>                   ] 144/400, 0.3 task/s, elapsed: 523s, ETA:   930s[>>>>>>>>>>                   ] 145/400, 0.3 task/s, elapsed: 527s, ETA:   926s[>>>>>>>>>>                   ] 146/400, 0.3 task/s, elapsed: 530s, ETA:   922s[>>>>>>>>>>                   ] 147/400, 0.3 task/s, elapsed: 534s, ETA:   919s[>>>>>>>>>>                   ] 148/400, 0.3 task/s, elapsed: 537s, ETA:   915s[>>>>>>>>>>                   ] 149/400, 0.3 task/s, elapsed: 541s, ETA:   912s[>>>>>>>>>>                   ] 150/400, 0.3 task/s, elapsed: 545s, ETA:   908s[>>>>>>>>>>                   ] 151/400, 0.3 task/s, elapsed: 548s, ETA:   904s[>>>>>>>>>>>                  ] 152/400, 0.3 task/s, elapsed: 552s, ETA:   901s[>>>>>>>>>>>                  ] 153/400, 0.3 task/s, elapsed: 556s, ETA:   897s[>>>>>>>>>>>                  ] 154/400, 0.3 task/s, elapsed: 559s, ETA:   893s[>>>>>>>>>>>                  ] 155/400, 0.3 task/s, elapsed: 563s, ETA:   890s[>>>>>>>>>>>                  ] 156/400, 0.3 task/s, elapsed: 566s, ETA:   886s[>>>>>>>>>>>                  ] 157/400, 0.3 task/s, elapsed: 570s, ETA:   882s[>>>>>>>>>>>                  ] 158/400, 0.3 task/s, elapsed: 574s, ETA:   879s[>>>>>>>>>>>                  ] 159/400, 0.3 task/s, elapsed: 577s, ETA:   875s[>>>>>>>>>>>                  ] 160/400, 0.3 task/s, elapsed: 581s, ETA:   871s[>>>>>>>>>>>                  ] 161/400, 0.3 task/s, elapsed: 585s, ETA:   868s[>>>>>>>>>>>                  ] 162/400, 0.3 task/s, elapsed: 588s, ETA:   864s[>>>>>>>>>>>                  ] 163/400, 0.3 task/s, elapsed: 592s, ETA:   860s[>>>>>>>>>>>                  ] 164/400, 0.3 task/s, elapsed: 595s, ETA:   857s[>>>>>>>>>>>                  ] 165/400, 0.3 task/s, elapsed: 599s, ETA:   853s[>>>>>>>>>>>>                 ] 166/400, 0.3 task/s, elapsed: 603s, ETA:   850s[>>>>>>>>>>>>                 ] 167/400, 0.3 task/s, elapsed: 606s, ETA:   846s[>>>>>>>>>>>>                 ] 168/400, 0.3 task/s, elapsed: 610s, ETA:   842s[>>>>>>>>>>>>                 ] 169/400, 0.3 task/s, elapsed: 614s, ETA:   839s[>>>>>>>>>>>>                 ] 170/400, 0.3 task/s, elapsed: 617s, ETA:   835s[>>>>>>>>>>>>                 ] 171/400, 0.3 task/s, elapsed: 621s, ETA:   831s[>>>>>>>>>>>>                 ] 172/400, 0.3 task/s, elapsed: 624s, ETA:   828s[>>>>>>>>>>>>                 ] 173/400, 0.3 task/s, elapsed: 628s, ETA:   824s[>>>>>>>>>>>>                 ] 174/400, 0.3 task/s, elapsed: 632s, ETA:   820s[>>>>>>>>>>>>                 ] 175/400, 0.3 task/s, elapsed: 635s, ETA:   817s[>>>>>>>>>>>>                 ] 176/400, 0.3 task/s, elapsed: 639s, ETA:   813s[>>>>>>>>>>>>                 ] 177/400, 0.3 task/s, elapsed: 643s, ETA:   810s[>>>>>>>>>>>>                 ] 178/400, 0.3 task/s, elapsed: 646s, ETA:   806s[>>>>>>>>>>>>                 ] 179/400, 0.3 task/s, elapsed: 650s, ETA:   802s[>>>>>>>>>>>>>                ] 180/400, 0.3 task/s, elapsed: 653s, ETA:   799s[>>>>>>>>>>>>>                ] 181/400, 0.3 task/s, elapsed: 657s, ETA:   795s[>>>>>>>>>>>>>                ] 182/400, 0.3 task/s, elapsed: 661s, ETA:   791s[>>>>>>>>>>>>>                ] 183/400, 0.3 task/s, elapsed: 664s, ETA:   788s[>>>>>>>>>>>>>                ] 184/400, 0.3 task/s, elapsed: 668s, ETA:   784s[>>>>>>>>>>>>>                ] 185/400, 0.3 task/s, elapsed: 672s, ETA:   780s[>>>>>>>>>>>>>                ] 186/400, 0.3 task/s, elapsed: 675s, ETA:   777s[>>>>>>>>>>>>>                ] 187/400, 0.3 task/s, elapsed: 679s, ETA:   773s[>>>>>>>>>>>>>                ] 188/400, 0.3 task/s, elapsed: 682s, ETA:   770s[>>>>>>>>>>>>>                ] 189/400, 0.3 task/s, elapsed: 686s, ETA:   766s[>>>>>>>>>>>>>                ] 190/400, 0.3 task/s, elapsed: 690s, ETA:   762s[>>>>>>>>>>>>>                ] 191/400, 0.3 task/s, elapsed: 693s, ETA:   759s[>>>>>>>>>>>>>                ] 192/400, 0.3 task/s, elapsed: 697s, ETA:   755s[>>>>>>>>>>>>>                ] 193/400, 0.3 task/s, elapsed: 701s, ETA:   751s[>>>>>>>>>>>>>>               ] 194/400, 0.3 task/s, elapsed: 704s, ETA:   748s[>>>>>>>>>>>>>>               ] 195/400, 0.3 task/s, elapsed: 708s, ETA:   744s[>>>>>>>>>>>>>>               ] 196/400, 0.3 task/s, elapsed: 711s, ETA:   740s[>>>>>>>>>>>>>>               ] 197/400, 0.3 task/s, elapsed: 715s, ETA:   737s[>>>>>>>>>>>>>>               ] 198/400, 0.3 task/s, elapsed: 719s, ETA:   733s[>>>>>>>>>>>>>>               ] 199/400, 0.3 task/s, elapsed: 722s, ETA:   730s[>>>>>>>>>>>>>>               ] 200/400, 0.3 task/s, elapsed: 726s, ETA:   726s[>>>>>>>>>>>>>>               ] 201/400, 0.3 task/s, elapsed: 730s, ETA:   722s[>>>>>>>>>>>>>>               ] 202/400, 0.3 task/s, elapsed: 733s, ETA:   719s[>>>>>>>>>>>>>>               ] 203/400, 0.3 task/s, elapsed: 737s, ETA:   715s[>>>>>>>>>>>>>>               ] 204/400, 0.3 task/s, elapsed: 740s, ETA:   711s[>>>>>>>>>>>>>>               ] 205/400, 0.3 task/s, elapsed: 744s, ETA:   708s[>>>>>>>>>>>>>>               ] 206/400, 0.3 task/s, elapsed: 748s, ETA:   704s[>>>>>>>>>>>>>>>              ] 207/400, 0.3 task/s, elapsed: 751s, ETA:   700s[>>>>>>>>>>>>>>>              ] 208/400, 0.3 task/s, elapsed: 755s, ETA:   697s[>>>>>>>>>>>>>>>              ] 209/400, 0.3 task/s, elapsed: 758s, ETA:   693s[>>>>>>>>>>>>>>>              ] 210/400, 0.3 task/s, elapsed: 762s, ETA:   690s[>>>>>>>>>>>>>>>              ] 211/400, 0.3 task/s, elapsed: 766s, ETA:   686s[>>>>>>>>>>>>>>>              ] 212/400, 0.3 task/s, elapsed: 769s, ETA:   682s[>>>>>>>>>>>>>>>              ] 213/400, 0.3 task/s, elapsed: 773s, ETA:   679s[>>>>>>>>>>>>>>>              ] 214/400, 0.3 task/s, elapsed: 777s, ETA:   675s[>>>>>>>>>>>>>>>              ] 215/400, 0.3 task/s, elapsed: 780s, ETA:   671s[>>>>>>>>>>>>>>>              ] 216/400, 0.3 task/s, elapsed: 784s, ETA:   668s[>>>>>>>>>>>>>>>              ] 217/400, 0.3 task/s, elapsed: 787s, ETA:   664s[>>>>>>>>>>>>>>>              ] 218/400, 0.3 task/s, elapsed: 791s, ETA:   660s[>>>>>>>>>>>>>>>              ] 219/400, 0.3 task/s, elapsed: 795s, ETA:   657s[>>>>>>>>>>>>>>>              ] 220/400, 0.3 task/s, elapsed: 798s, ETA:   653s[>>>>>>>>>>>>>>>>             ] 221/400, 0.3 task/s, elapsed: 802s, ETA:   650s[>>>>>>>>>>>>>>>>             ] 222/400, 0.3 task/s, elapsed: 806s, ETA:   646s[>>>>>>>>>>>>>>>>             ] 223/400, 0.3 task/s, elapsed: 809s, ETA:   642s[>>>>>>>>>>>>>>>>             ] 224/400, 0.3 task/s, elapsed: 813s, ETA:   639s[>>>>>>>>>>>>>>>>             ] 225/400, 0.3 task/s, elapsed: 816s, ETA:   635s[>>>>>>>>>>>>>>>>             ] 226/400, 0.3 task/s, elapsed: 820s, ETA:   631s[>>>>>>>>>>>>>>>>             ] 227/400, 0.3 task/s, elapsed: 824s, ETA:   628s[>>>>>>>>>>>>>>>>             ] 228/400, 0.3 task/s, elapsed: 827s, ETA:   624s[>>>>>>>>>>>>>>>>             ] 229/400, 0.3 task/s, elapsed: 831s, ETA:   620s[>>>>>>>>>>>>>>>>             ] 230/400, 0.3 task/s, elapsed: 835s, ETA:   617s[>>>>>>>>>>>>>>>>             ] 231/400, 0.3 task/s, elapsed: 838s, ETA:   613s[>>>>>>>>>>>>>>>>             ] 232/400, 0.3 task/s, elapsed: 842s, ETA:   610s[>>>>>>>>>>>>>>>>             ] 233/400, 0.3 task/s, elapsed: 845s, ETA:   606s[>>>>>>>>>>>>>>>>             ] 234/400, 0.3 task/s, elapsed: 849s, ETA:   602s[>>>>>>>>>>>>>>>>>            ] 235/400, 0.3 task/s, elapsed: 853s, ETA:   599s[>>>>>>>>>>>>>>>>>            ] 236/400, 0.3 task/s, elapsed: 856s, ETA:   595s[>>>>>>>>>>>>>>>>>            ] 237/400, 0.3 task/s, elapsed: 860s, ETA:   591s[>>>>>>>>>>>>>>>>>            ] 238/400, 0.3 task/s, elapsed: 864s, ETA:   588s[>>>>>>>>>>>>>>>>>            ] 239/400, 0.3 task/s, elapsed: 867s, ETA:   584s[>>>>>>>>>>>>>>>>>            ] 240/400, 0.3 task/s, elapsed: 871s, ETA:   581s[>>>>>>>>>>>>>>>>>            ] 241/400, 0.3 task/s, elapsed: 874s, ETA:   577s[>>>>>>>>>>>>>>>>>            ] 242/400, 0.3 task/s, elapsed: 878s, ETA:   573s[>>>>>>>>>>>>>>>>>            ] 243/400, 0.3 task/s, elapsed: 882s, ETA:   570s[>>>>>>>>>>>>>>>>>            ] 244/400, 0.3 task/s, elapsed: 885s, ETA:   566s[>>>>>>>>>>>>>>>>>            ] 245/400, 0.3 task/s, elapsed: 889s, ETA:   562s[>>>>>>>>>>>>>>>>>            ] 246/400, 0.3 task/s, elapsed: 893s, ETA:   559s[>>>>>>>>>>>>>>>>>            ] 247/400, 0.3 task/s, elapsed: 896s, ETA:   555s[>>>>>>>>>>>>>>>>>            ] 248/400, 0.3 task/s, elapsed: 900s, ETA:   551s[>>>>>>>>>>>>>>>>>>           ] 249/400, 0.3 task/s, elapsed: 903s, ETA:   548s[>>>>>>>>>>>>>>>>>>           ] 250/400, 0.3 task/s, elapsed: 907s, ETA:   544s[>>>>>>>>>>>>>>>>>>           ] 251/400, 0.3 task/s, elapsed: 911s, ETA:   541s[>>>>>>>>>>>>>>>>>>           ] 252/400, 0.3 task/s, elapsed: 914s, ETA:   537s[>>>>>>>>>>>>>>>>>>           ] 253/400, 0.3 task/s, elapsed: 918s, ETA:   533s[>>>>>>>>>>>>>>>>>>           ] 254/400, 0.3 task/s, elapsed: 922s, ETA:   530s[>>>>>>>>>>>>>>>>>>           ] 255/400, 0.3 task/s, elapsed: 925s, ETA:   526s[>>>>>>>>>>>>>>>>>>           ] 256/400, 0.3 task/s, elapsed: 929s, ETA:   522s[>>>>>>>>>>>>>>>>>>           ] 257/400, 0.3 task/s, elapsed: 932s, ETA:   519s[>>>>>>>>>>>>>>>>>>           ] 258/400, 0.3 task/s, elapsed: 936s, ETA:   515s[>>>>>>>>>>>>>>>>>>           ] 259/400, 0.3 task/s, elapsed: 940s, ETA:   512s[>>>>>>>>>>>>>>>>>>           ] 260/400, 0.3 task/s, elapsed: 943s, ETA:   508s[>>>>>>>>>>>>>>>>>>           ] 261/400, 0.3 task/s, elapsed: 947s, ETA:   504s[>>>>>>>>>>>>>>>>>>           ] 262/400, 0.3 task/s, elapsed: 951s, ETA:   501s[>>>>>>>>>>>>>>>>>>>          ] 263/400, 0.3 task/s, elapsed: 954s, ETA:   497s[>>>>>>>>>>>>>>>>>>>          ] 264/400, 0.3 task/s, elapsed: 958s, ETA:   493s[>>>>>>>>>>>>>>>>>>>          ] 265/400, 0.3 task/s, elapsed: 961s, ETA:   490s[>>>>>>>>>>>>>>>>>>>          ] 266/400, 0.3 task/s, elapsed: 965s, ETA:   486s[>>>>>>>>>>>>>>>>>>>          ] 267/400, 0.3 task/s, elapsed: 969s, ETA:   482s[>>>>>>>>>>>>>>>>>>>          ] 268/400, 0.3 task/s, elapsed: 972s, ETA:   479s[>>>>>>>>>>>>>>>>>>>          ] 269/400, 0.3 task/s, elapsed: 976s, ETA:   475s[>>>>>>>>>>>>>>>>>>>          ] 270/400, 0.3 task/s, elapsed: 979s, ETA:   472s[>>>>>>>>>>>>>>>>>>>          ] 271/400, 0.3 task/s, elapsed: 983s, ETA:   468s[>>>>>>>>>>>>>>>>>>>          ] 272/400, 0.3 task/s, elapsed: 987s, ETA:   464s[>>>>>>>>>>>>>>>>>>>          ] 273/400, 0.3 task/s, elapsed: 990s, ETA:   461s[>>>>>>>>>>>>>>>>>>>          ] 274/400, 0.3 task/s, elapsed: 994s, ETA:   457s[>>>>>>>>>>>>>>>>>>>          ] 275/400, 0.3 task/s, elapsed: 998s, ETA:   453s[>>>>>>>>>>>>>>>>>>>         ] 276/400, 0.3 task/s, elapsed: 1001s, ETA:   450s[>>>>>>>>>>>>>>>>>>>         ] 277/400, 0.3 task/s, elapsed: 1005s, ETA:   446s[>>>>>>>>>>>>>>>>>>>         ] 278/400, 0.3 task/s, elapsed: 1008s, ETA:   443s[>>>>>>>>>>>>>>>>>>>         ] 279/400, 0.3 task/s, elapsed: 1012s, ETA:   439s[>>>>>>>>>>>>>>>>>>>         ] 280/400, 0.3 task/s, elapsed: 1016s, ETA:   435s[>>>>>>>>>>>>>>>>>>>         ] 281/400, 0.3 task/s, elapsed: 1019s, ETA:   432s[>>>>>>>>>>>>>>>>>>>         ] 282/400, 0.3 task/s, elapsed: 1023s, ETA:   428s[>>>>>>>>>>>>>>>>>>>         ] 283/400, 0.3 task/s, elapsed: 1027s, ETA:   424s[>>>>>>>>>>>>>>>>>>>         ] 284/400, 0.3 task/s, elapsed: 1030s, ETA:   421s[>>>>>>>>>>>>>>>>>>>         ] 285/400, 0.3 task/s, elapsed: 1034s, ETA:   417s[>>>>>>>>>>>>>>>>>>>>        ] 286/400, 0.3 task/s, elapsed: 1037s, ETA:   414s[>>>>>>>>>>>>>>>>>>>>        ] 287/400, 0.3 task/s, elapsed: 1041s, ETA:   410s[>>>>>>>>>>>>>>>>>>>>        ] 288/400, 0.3 task/s, elapsed: 1045s, ETA:   406s[>>>>>>>>>>>>>>>>>>>>        ] 289/400, 0.3 task/s, elapsed: 1048s, ETA:   403s[>>>>>>>>>>>>>>>>>>>>        ] 290/400, 0.3 task/s, elapsed: 1052s, ETA:   399s[>>>>>>>>>>>>>>>>>>>>        ] 291/400, 0.3 task/s, elapsed: 1056s, ETA:   395s[>>>>>>>>>>>>>>>>>>>>        ] 292/400, 0.3 task/s, elapsed: 1059s, ETA:   392s[>>>>>>>>>>>>>>>>>>>>        ] 293/400, 0.3 task/s, elapsed: 1063s, ETA:   388s[>>>>>>>>>>>>>>>>>>>>        ] 294/400, 0.3 task/s, elapsed: 1066s, ETA:   384s[>>>>>>>>>>>>>>>>>>>>        ] 295/400, 0.3 task/s, elapsed: 1070s, ETA:   381s[>>>>>>>>>>>>>>>>>>>>        ] 296/400, 0.3 task/s, elapsed: 1074s, ETA:   377s[>>>>>>>>>>>>>>>>>>>>        ] 297/400, 0.3 task/s, elapsed: 1077s, ETA:   374s[>>>>>>>>>>>>>>>>>>>>        ] 298/400, 0.3 task/s, elapsed: 1081s, ETA:   370s[>>>>>>>>>>>>>>>>>>>>        ] 299/400, 0.3 task/s, elapsed: 1085s, ETA:   366s[>>>>>>>>>>>>>>>>>>>>>       ] 300/400, 0.3 task/s, elapsed: 1088s, ETA:   363s[>>>>>>>>>>>>>>>>>>>>>       ] 301/400, 0.3 task/s, elapsed: 1092s, ETA:   359s[>>>>>>>>>>>>>>>>>>>>>       ] 302/400, 0.3 task/s, elapsed: 1095s, ETA:   355s[>>>>>>>>>>>>>>>>>>>>>       ] 303/400, 0.3 task/s, elapsed: 1099s, ETA:   352s[>>>>>>>>>>>>>>>>>>>>>       ] 304/400, 0.3 task/s, elapsed: 1103s, ETA:   348s[>>>>>>>>>>>>>>>>>>>>>       ] 305/400, 0.3 task/s, elapsed: 1106s, ETA:   345s[>>>>>>>>>>>>>>>>>>>>>       ] 306/400, 0.3 task/s, elapsed: 1110s, ETA:   341s[>>>>>>>>>>>>>>>>>>>>>       ] 307/400, 0.3 task/s, elapsed: 1113s, ETA:   337s[>>>>>>>>>>>>>>>>>>>>>       ] 308/400, 0.3 task/s, elapsed: 1117s, ETA:   334s[>>>>>>>>>>>>>>>>>>>>>       ] 309/400, 0.3 task/s, elapsed: 1121s, ETA:   330s[>>>>>>>>>>>>>>>>>>>>>       ] 310/400, 0.3 task/s, elapsed: 1124s, ETA:   326s[>>>>>>>>>>>>>>>>>>>>>       ] 311/400, 0.3 task/s, elapsed: 1128s, ETA:   323s[>>>>>>>>>>>>>>>>>>>>>       ] 312/400, 0.3 task/s, elapsed: 1132s, ETA:   319s[>>>>>>>>>>>>>>>>>>>>>       ] 313/400, 0.3 task/s, elapsed: 1135s, ETA:   316s[>>>>>>>>>>>>>>>>>>>>>       ] 314/400, 0.3 task/s, elapsed: 1139s, ETA:   312s[>>>>>>>>>>>>>>>>>>>>>>      ] 315/400, 0.3 task/s, elapsed: 1142s, ETA:   308s[>>>>>>>>>>>>>>>>>>>>>>      ] 316/400, 0.3 task/s, elapsed: 1146s, ETA:   305s[>>>>>>>>>>>>>>>>>>>>>>      ] 317/400, 0.3 task/s, elapsed: 1150s, ETA:   301s[>>>>>>>>>>>>>>>>>>>>>>      ] 318/400, 0.3 task/s, elapsed: 1153s, ETA:   297s[>>>>>>>>>>>>>>>>>>>>>>      ] 319/400, 0.3 task/s, elapsed: 1157s, ETA:   294s[>>>>>>>>>>>>>>>>>>>>>>      ] 320/400, 0.3 task/s, elapsed: 1161s, ETA:   290s[>>>>>>>>>>>>>>>>>>>>>>      ] 321/400, 0.3 task/s, elapsed: 1164s, ETA:   287s[>>>>>>>>>>>>>>>>>>>>>>      ] 322/400, 0.3 task/s, elapsed: 1168s, ETA:   283s[>>>>>>>>>>>>>>>>>>>>>>      ] 323/400, 0.3 task/s, elapsed: 1172s, ETA:   279s[>>>>>>>>>>>>>>>>>>>>>>      ] 324/400, 0.3 task/s, elapsed: 1175s, ETA:   276s[>>>>>>>>>>>>>>>>>>>>>>      ] 325/400, 0.3 task/s, elapsed: 1179s, ETA:   272s[>>>>>>>>>>>>>>>>>>>>>>      ] 326/400, 0.3 task/s, elapsed: 1183s, ETA:   268s[>>>>>>>>>>>>>>>>>>>>>>      ] 327/400, 0.3 task/s, elapsed: 1186s, ETA:   265s[>>>>>>>>>>>>>>>>>>>>>>      ] 328/400, 0.3 task/s, elapsed: 1190s, ETA:   261s[>>>>>>>>>>>>>>>>>>>>>>>     ] 329/400, 0.3 task/s, elapsed: 1194s, ETA:   258s[>>>>>>>>>>>>>>>>>>>>>>>     ] 330/400, 0.3 task/s, elapsed: 1198s, ETA:   254s[>>>>>>>>>>>>>>>>>>>>>>>     ] 331/400, 0.3 task/s, elapsed: 1201s, ETA:   250s[>>>>>>>>>>>>>>>>>>>>>>>     ] 332/400, 0.3 task/s, elapsed: 1205s, ETA:   247s[>>>>>>>>>>>>>>>>>>>>>>>     ] 333/400, 0.3 task/s, elapsed: 1209s, ETA:   243s[>>>>>>>>>>>>>>>>>>>>>>>     ] 334/400, 0.3 task/s, elapsed: 1212s, ETA:   240s[>>>>>>>>>>>>>>>>>>>>>>>     ] 335/400, 0.3 task/s, elapsed: 1216s, ETA:   236s[>>>>>>>>>>>>>>>>>>>>>>>     ] 336/400, 0.3 task/s, elapsed: 1220s, ETA:   232s[>>>>>>>>>>>>>>>>>>>>>>>     ] 337/400, 0.3 task/s, elapsed: 1224s, ETA:   229s[>>>>>>>>>>>>>>>>>>>>>>>     ] 338/400, 0.3 task/s, elapsed: 1227s, ETA:   225s[>>>>>>>>>>>>>>>>>>>>>>>     ] 339/400, 0.3 task/s, elapsed: 1231s, ETA:   221s[>>>>>>>>>>>>>>>>>>>>>>>     ] 340/400, 0.3 task/s, elapsed: 1235s, ETA:   218s[>>>>>>>>>>>>>>>>>>>>>>>     ] 341/400, 0.3 task/s, elapsed: 1238s, ETA:   214s[>>>>>>>>>>>>>>>>>>>>>>>     ] 342/400, 0.3 task/s, elapsed: 1242s, ETA:   211s[>>>>>>>>>>>>>>>>>>>>>>>>    ] 343/400, 0.3 task/s, elapsed: 1246s, ETA:   207s[>>>>>>>>>>>>>>>>>>>>>>>>    ] 344/400, 0.3 task/s, elapsed: 1249s, ETA:   203s[>>>>>>>>>>>>>>>>>>>>>>>>    ] 345/400, 0.3 task/s, elapsed: 1253s, ETA:   200s[>>>>>>>>>>>>>>>>>>>>>>>>    ] 346/400, 0.3 task/s, elapsed: 1257s, ETA:   196s[>>>>>>>>>>>>>>>>>>>>>>>>    ] 347/400, 0.3 task/s, elapsed: 1261s, ETA:   193s[>>>>>>>>>>>>>>>>>>>>>>>>    ] 348/400, 0.3 task/s, elapsed: 1264s, ETA:   189s[>>>>>>>>>>>>>>>>>>>>>>>>    ] 349/400, 0.3 task/s, elapsed: 1268s, ETA:   185s[>>>>>>>>>>>>>>>>>>>>>>>>    ] 350/400, 0.3 task/s, elapsed: 1272s, ETA:   182s[>>>>>>>>>>>>>>>>>>>>>>>>    ] 351/400, 0.3 task/s, elapsed: 1275s, ETA:   178s[>>>>>>>>>>>>>>>>>>>>>>>>    ] 352/400, 0.3 task/s, elapsed: 1279s, ETA:   174s[>>>>>>>>>>>>>>>>>>>>>>>>    ] 353/400, 0.3 task/s, elapsed: 1283s, ETA:   171s[>>>>>>>>>>>>>>>>>>>>>>>>    ] 354/400, 0.3 task/s, elapsed: 1287s, ETA:   167s[>>>>>>>>>>>>>>>>>>>>>>>>    ] 355/400, 0.3 task/s, elapsed: 1290s, ETA:   164s[>>>>>>>>>>>>>>>>>>>>>>>>    ] 356/400, 0.3 task/s, elapsed: 1294s, ETA:   160s[>>>>>>>>>>>>>>>>>>>>>>>>    ] 357/400, 0.3 task/s, elapsed: 1298s, ETA:   156s[>>>>>>>>>>>>>>>>>>>>>>>>>   ] 358/400, 0.3 task/s, elapsed: 1301s, ETA:   153s[>>>>>>>>>>>>>>>>>>>>>>>>>   ] 359/400, 0.3 task/s, elapsed: 1305s, ETA:   149s[>>>>>>>>>>>>>>>>>>>>>>>>>   ] 360/400, 0.3 task/s, elapsed: 1309s, ETA:   145s[>>>>>>>>>>>>>>>>>>>>>>>>>   ] 361/400, 0.3 task/s, elapsed: 1312s, ETA:   142s[>>>>>>>>>>>>>>>>>>>>>>>>>   ] 362/400, 0.3 task/s, elapsed: 1316s, ETA:   138s[>>>>>>>>>>>>>>>>>>>>>>>>>   ] 363/400, 0.3 task/s, elapsed: 1320s, ETA:   135s[>>>>>>>>>>>>>>>>>>>>>>>>>   ] 364/400, 0.3 task/s, elapsed: 1324s, ETA:   131s[>>>>>>>>>>>>>>>>>>>>>>>>>   ] 365/400, 0.3 task/s, elapsed: 1327s, ETA:   127s[>>>>>>>>>>>>>>>>>>>>>>>>>   ] 366/400, 0.3 task/s, elapsed: 1331s, ETA:   124s[>>>>>>>>>>>>>>>>>>>>>>>>>   ] 367/400, 0.3 task/s, elapsed: 1335s, ETA:   120s[>>>>>>>>>>>>>>>>>>>>>>>>>   ] 368/400, 0.3 task/s, elapsed: 1338s, ETA:   116s[>>>>>>>>>>>>>>>>>>>>>>>>>   ] 369/400, 0.3 task/s, elapsed: 1342s, ETA:   113s[>>>>>>>>>>>>>>>>>>>>>>>>>   ] 370/400, 0.3 task/s, elapsed: 1346s, ETA:   109s[>>>>>>>>>>>>>>>>>>>>>>>>>   ] 371/400, 0.3 task/s, elapsed: 1350s, ETA:   105s[>>>>>>>>>>>>>>>>>>>>>>>>>>  ] 372/400, 0.3 task/s, elapsed: 1353s, ETA:   102s[>>>>>>>>>>>>>>>>>>>>>>>>>>  ] 373/400, 0.3 task/s, elapsed: 1357s, ETA:    98s[>>>>>>>>>>>>>>>>>>>>>>>>>>  ] 374/400, 0.3 task/s, elapsed: 1361s, ETA:    95s[>>>>>>>>>>>>>>>>>>>>>>>>>>  ] 375/400, 0.3 task/s, elapsed: 1364s, ETA:    91s[>>>>>>>>>>>>>>>>>>>>>>>>>>  ] 376/400, 0.3 task/s, elapsed: 1368s, ETA:    87s[>>>>>>>>>>>>>>>>>>>>>>>>>>  ] 377/400, 0.3 task/s, elapsed: 1372s, ETA:    84s[>>>>>>>>>>>>>>>>>>>>>>>>>>  ] 378/400, 0.3 task/s, elapsed: 1375s, ETA:    80s[>>>>>>>>>>>>>>>>>>>>>>>>>>  ] 379/400, 0.3 task/s, elapsed: 1379s, ETA:    76s[>>>>>>>>>>>>>>>>>>>>>>>>>>  ] 380/400, 0.3 task/s, elapsed: 1383s, ETA:    73s[>>>>>>>>>>>>>>>>>>>>>>>>>>  ] 381/400, 0.3 task/s, elapsed: 1387s, ETA:    69s[>>>>>>>>>>>>>>>>>>>>>>>>>>  ] 382/400, 0.3 task/s, elapsed: 1390s, ETA:    66s[>>>>>>>>>>>>>>>>>>>>>>>>>>  ] 383/400, 0.3 task/s, elapsed: 1394s, ETA:    62s[>>>>>>>>>>>>>>>>>>>>>>>>>>  ] 384/400, 0.3 task/s, elapsed: 1398s, ETA:    58s[>>>>>>>>>>>>>>>>>>>>>>>>>>  ] 385/400, 0.3 task/s, elapsed: 1401s, ETA:    55s[>>>>>>>>>>>>>>>>>>>>>>>>>>> ] 386/400, 0.3 task/s, elapsed: 1405s, ETA:    51s[>>>>>>>>>>>>>>>>>>>>>>>>>>> ] 387/400, 0.3 task/s, elapsed: 1409s, ETA:    47s[>>>>>>>>>>>>>>>>>>>>>>>>>>> ] 388/400, 0.3 task/s, elapsed: 1413s, ETA:    44s[>>>>>>>>>>>>>>>>>>>>>>>>>>> ] 389/400, 0.3 task/s, elapsed: 1416s, ETA:    40s[>>>>>>>>>>>>>>>>>>>>>>>>>>> ] 390/400, 0.3 task/s, elapsed: 1420s, ETA:    36s[>>>>>>>>>>>>>>>>>>>>>>>>>>> ] 391/400, 0.3 task/s, elapsed: 1424s, ETA:    33s[>>>>>>>>>>>>>>>>>>>>>>>>>>> ] 392/400, 0.3 task/s, elapsed: 1427s, ETA:    29s[>>>>>>>>>>>>>>>>>>>>>>>>>>> ] 393/400, 0.3 task/s, elapsed: 1431s, ETA:    25s[>>>>>>>>>>>>>>>>>>>>>>>>>>> ] 394/400, 0.3 task/s, elapsed: 1435s, ETA:    22s[>>>>>>>>>>>>>>>>>>>>>>>>>>> ] 395/400, 0.3 task/s, elapsed: 1438s, ETA:    18s[>>>>>>>>>>>>>>>>>>>>>>>>>>> ] 396/400, 0.3 task/s, elapsed: 1442s, ETA:    15s[>>>>>>>>>>>>>>>>>>>>>>>>>>> ] 397/400, 0.3 task/s, elapsed: 1446s, ETA:    11s[>>>>>>>>>>>>>>>>>>>>>>>>>>> ] 398/400, 0.3 task/s, elapsed: 1450s, ETA:     7s[>>>>>>>>>>>>>>>>>>>>>>>>>>> ] 399/400, 0.3 task/s, elapsed: 1453s, ETA:     4s[>>>>>>>>>>>>>>>>>>>>>>>>>>>>] 400/400, 0.3 task/s, elapsed: 1457s, ETA:     0s
writing results to work_dirs/res.pkl
per class results:

+---------------+-------+-------+
| Class         | IoU   | Acc   |
+---------------+-------+-------+
| road          | 93.99 | 99.46 |
| sidewalk      | 64.53 | 74.68 |
| building      | 81.24 | 97.24 |
| wall          | 58.11 | 73.3  |
| fence         | 26.48 | 28.05 |
| pole          | 51.52 | 58.31 |
| traffic light | 43.69 | 47.94 |
| traffic sign  | 75.6  | 90.83 |
| vegetation    | 86.97 | 91.27 |
| terrain       | 69.81 | 86.45 |
| sky           | 97.83 | 98.99 |
| person        | 69.18 | 83.06 |
| rider         | 72.53 | 89.11 |
| car           | 86.49 | 94.25 |
| truck         | 77.63 | 81.76 |
| bus           | 93.55 | 97.01 |
| train         | 91.04 | 96.08 |
| motorcycle    | 64.76 | 72.27 |
| bicycle       | 67.94 | 85.47 |
+---------------+-------+-------+
Summary:

+--------+-------+-------+-------+
| Scope  | mIoU  | mAcc  | aAcc  |
+--------+-------+-------+-------+
| global | 72.26 | 81.34 | 93.92 |
+--------+-------+-------+-------+
Logged mIoU: 0.7226
>>>>>>>>init mit_b5_sparse_prompt 0.0001
load checkpoint from local path: /gpfs/data/fs72306/leijx0408/SVDP/segformer.b5.1024x1024.city.160k.pth
The model and loaded state dict do not match exactly

missing keys in source state_dict: backbone.prompt.patch, backbone.prompt.feature_prompts.0

[                                                  ] 0/400, elapsed: 0s, ETA:[                                 ] 1/400, 0.2 task/s, elapsed: 4s, ETA:  1765s[                                 ] 2/400, 0.2 task/s, elapsed: 8s, ETA:  1603s[                                ] 3/400, 0.3 task/s, elapsed: 12s, ETA:  1546s[                                ] 4/400, 0.3 task/s, elapsed: 15s, ETA:  1513s[                                ] 5/400, 0.3 task/s, elapsed: 19s, ETA:  1493s[                                ] 6/400, 0.3 task/s, elapsed: 22s, ETA:  1477s[                                ] 7/400, 0.3 task/s, elapsed: 26s, ETA:  1466s[                                ] 8/400, 0.3 task/s, elapsed: 30s, ETA:  1456s[                                ] 9/400, 0.3 task/s, elapsed: 33s, ETA:  1448s[                               ] 10/400, 0.3 task/s, elapsed: 37s, ETA:  1440s[                               ] 11/400, 0.3 task/s, elapsed: 41s, ETA:  1435s[                               ] 12/400, 0.3 task/s, elapsed: 44s, ETA:  1428s[>                              ] 13/400, 0.3 task/s, elapsed: 48s, ETA:  1423s[>                              ] 14/400, 0.3 task/s, elapsed: 51s, ETA:  1418s[>                              ] 15/400, 0.3 task/s, elapsed: 55s, ETA:  1413s[>                              ] 16/400, 0.3 task/s, elapsed: 59s, ETA:  1408s[>                              ] 17/400, 0.3 task/s, elapsed: 62s, ETA:  1403s[>                              ] 18/400, 0.3 task/s, elapsed: 66s, ETA:  1399s[>                              ] 19/400, 0.3 task/s, elapsed: 70s, ETA:  1394s[>                              ] 20/400, 0.3 task/s, elapsed: 73s, ETA:  1390s[>                              ] 21/400, 0.3 task/s, elapsed: 77s, ETA:  1386s[>                              ] 22/400, 0.3 task/s, elapsed: 80s, ETA:  1381s[>                              ] 23/400, 0.3 task/s, elapsed: 84s, ETA:  1377s[>                              ] 24/400, 0.3 task/s, elapsed: 88s, ETA:  1373s[>                              ] 25/400, 0.3 task/s, elapsed: 91s, ETA:  1369s[>>                             ] 26/400, 0.3 task/s, elapsed: 95s, ETA:  1365s[>>                             ] 27/400, 0.3 task/s, elapsed: 99s, ETA:  1361s[>>                            ] 28/400, 0.3 task/s, elapsed: 102s, ETA:  1357s[>>                            ] 29/400, 0.3 task/s, elapsed: 106s, ETA:  1353s[>>                            ] 30/400, 0.3 task/s, elapsed: 109s, ETA:  1349s[>>                            ] 31/400, 0.3 task/s, elapsed: 113s, ETA:  1346s[>>                            ] 32/400, 0.3 task/s, elapsed: 117s, ETA:  1342s[>>                            ] 33/400, 0.3 task/s, elapsed: 120s, ETA:  1338s[>>                            ] 34/400, 0.3 task/s, elapsed: 124s, ETA:  1334s[>>                            ] 35/400, 0.3 task/s, elapsed: 128s, ETA:  1330s[>>                            ] 36/400, 0.3 task/s, elapsed: 131s, ETA:  1327s[>>                            ] 37/400, 0.3 task/s, elapsed: 135s, ETA:  1323s[>>                            ] 38/400, 0.3 task/s, elapsed: 138s, ETA:  1319s[>>                            ] 39/400, 0.3 task/s, elapsed: 142s, ETA:  1315s[>>>                           ] 40/400, 0.3 task/s, elapsed: 146s, ETA:  1311s[>>>                           ] 41/400, 0.3 task/s, elapsed: 149s, ETA:  1308s[>>>                           ] 42/400, 0.3 task/s, elapsed: 153s, ETA:  1304s[>>>                           ] 43/400, 0.3 task/s, elapsed: 157s, ETA:  1301s[>>>                           ] 44/400, 0.3 task/s, elapsed: 160s, ETA:  1297s[>>>                           ] 45/400, 0.3 task/s, elapsed: 164s, ETA:  1294s[>>>                           ] 46/400, 0.3 task/s, elapsed: 168s, ETA:  1290s[>>>                           ] 47/400, 0.3 task/s, elapsed: 171s, ETA:  1286s[>>>                           ] 48/400, 0.3 task/s, elapsed: 175s, ETA:  1282s[>>>                           ] 49/400, 0.3 task/s, elapsed: 178s, ETA:  1279s[>>>                           ] 50/400, 0.3 task/s, elapsed: 182s, ETA:  1275s[>>>                           ] 51/400, 0.3 task/s, elapsed: 186s, ETA:  1271s[>>>                           ] 52/400, 0.3 task/s, elapsed: 189s, ETA:  1267s[>>>                           ] 53/400, 0.3 task/s, elapsed: 193s, ETA:  1264s[>>>>                          ] 54/400, 0.3 task/s, elapsed: 197s, ETA:  1260s[>>>>                          ] 55/400, 0.3 task/s, elapsed: 200s, ETA:  1256s[>>>>                          ] 56/400, 0.3 task/s, elapsed: 204s, ETA:  1253s[>>>>                          ] 57/400, 0.3 task/s, elapsed: 208s, ETA:  1249s[>>>>                          ] 58/400, 0.3 task/s, elapsed: 211s, ETA:  1245s[>>>>                          ] 59/400, 0.3 task/s, elapsed: 215s, ETA:  1242s[>>>>                          ] 60/400, 0.3 task/s, elapsed: 218s, ETA:  1238s[>>>>                          ] 61/400, 0.3 task/s, elapsed: 222s, ETA:  1234s[>>>>                          ] 62/400, 0.3 task/s, elapsed: 226s, ETA:  1231s[>>>>                          ] 63/400, 0.3 task/s, elapsed: 229s, ETA:  1227s[>>>>                          ] 64/400, 0.3 task/s, elapsed: 233s, ETA:  1223s[>>>>                          ] 65/400, 0.3 task/s, elapsed: 237s, ETA:  1220s[>>>>                          ] 66/400, 0.3 task/s, elapsed: 240s, ETA:  1216s[>>>>>                         ] 67/400, 0.3 task/s, elapsed: 244s, ETA:  1212s[>>>>>                         ] 68/400, 0.3 task/s, elapsed: 248s, ETA:  1209s[>>>>>                         ] 69/400, 0.3 task/s, elapsed: 251s, ETA:  1205s[>>>>>                         ] 70/400, 0.3 task/s, elapsed: 255s, ETA:  1201s[>>>>>                         ] 71/400, 0.3 task/s, elapsed: 258s, ETA:  1198s[>>>>>                         ] 72/400, 0.3 task/s, elapsed: 262s, ETA:  1194s[>>>>>                         ] 73/400, 0.3 task/s, elapsed: 266s, ETA:  1190s[>>>>>                         ] 74/400, 0.3 task/s, elapsed: 269s, ETA:  1187s[>>>>>                         ] 75/400, 0.3 task/s, elapsed: 273s, ETA:  1183s[>>>>>                         ] 76/400, 0.3 task/s, elapsed: 277s, ETA:  1179s[>>>>>                         ] 77/400, 0.3 task/s, elapsed: 280s, ETA:  1176s[>>>>>                         ] 78/400, 0.3 task/s, elapsed: 284s, ETA:  1172s[>>>>>                         ] 79/400, 0.3 task/s, elapsed: 288s, ETA:  1168s[>>>>>>                        ] 80/400, 0.3 task/s, elapsed: 291s, ETA:  1165s[>>>>>>                        ] 81/400, 0.3 task/s, elapsed: 295s, ETA:  1161s[>>>>>>                        ] 82/400, 0.3 task/s, elapsed: 298s, ETA:  1157s[>>>>>>                        ] 83/400, 0.3 task/s, elapsed: 302s, ETA:  1154s[>>>>>>                        ] 84/400, 0.3 task/s, elapsed: 306s, ETA:  1150s[>>>>>>                        ] 85/400, 0.3 task/s, elapsed: 309s, ETA:  1146s[>>>>>>                        ] 86/400, 0.3 task/s, elapsed: 313s, ETA:  1143s[>>>>>>                        ] 87/400, 0.3 task/s, elapsed: 317s, ETA:  1139s[>>>>>>                        ] 88/400, 0.3 task/s, elapsed: 320s, ETA:  1135s[>>>>>>                        ] 89/400, 0.3 task/s, elapsed: 324s, ETA:  1132s[>>>>>>                        ] 90/400, 0.3 task/s, elapsed: 327s, ETA:  1128s[>>>>>>                        ] 91/400, 0.3 task/s, elapsed: 331s, ETA:  1124s[>>>>>>                        ] 92/400, 0.3 task/s, elapsed: 335s, ETA:  1121s[>>>>>>                        ] 93/400, 0.3 task/s, elapsed: 338s, ETA:  1117s[>>>>>>>                       ] 94/400, 0.3 task/s, elapsed: 342s, ETA:  1113s[>>>>>>>                       ] 95/400, 0.3 task/s, elapsed: 346s, ETA:  1110s[>>>>>>>                       ] 96/400, 0.3 task/s, elapsed: 349s, ETA:  1106s[>>>>>>>                       ] 97/400, 0.3 task/s, elapsed: 353s, ETA:  1102s[>>>>>>>                       ] 98/400, 0.3 task/s, elapsed: 357s, ETA:  1099s[>>>>>>>                       ] 99/400, 0.3 task/s, elapsed: 360s, ETA:  1095s[>>>>>>>                      ] 100/400, 0.3 task/s, elapsed: 364s, ETA:  1091s[>>>>>>>                      ] 101/400, 0.3 task/s, elapsed: 367s, ETA:  1088s[>>>>>>>                      ] 102/400, 0.3 task/s, elapsed: 371s, ETA:  1084s[>>>>>>>                      ] 103/400, 0.3 task/s, elapsed: 375s, ETA:  1080s[>>>>>>>                      ] 104/400, 0.3 task/s, elapsed: 378s, ETA:  1077s[>>>>>>>                      ] 105/400, 0.3 task/s, elapsed: 382s, ETA:  1073s[>>>>>>>                      ] 106/400, 0.3 task/s, elapsed: 386s, ETA:  1069s[>>>>>>>                      ] 107/400, 0.3 task/s, elapsed: 389s, ETA:  1066s[>>>>>>>                      ] 108/400, 0.3 task/s, elapsed: 393s, ETA:  1062s[>>>>>>>                      ] 109/400, 0.3 task/s, elapsed: 396s, ETA:  1058s[>>>>>>>                      ] 110/400, 0.3 task/s, elapsed: 400s, ETA:  1055s[>>>>>>>>                     ] 111/400, 0.3 task/s, elapsed: 404s, ETA:  1051s[>>>>>>>>                     ] 112/400, 0.3 task/s, elapsed: 407s, ETA:  1048s[>>>>>>>>                     ] 113/400, 0.3 task/s, elapsed: 411s, ETA:  1044s[>>>>>>>>                     ] 114/400, 0.3 task/s, elapsed: 415s, ETA:  1040s[>>>>>>>>                     ] 115/400, 0.3 task/s, elapsed: 418s, ETA:  1037s[>>>>>>>>                     ] 116/400, 0.3 task/s, elapsed: 422s, ETA:  1033s[>>>>>>>>                     ] 117/400, 0.3 task/s, elapsed: 426s, ETA:  1029s[>>>>>>>>                     ] 118/400, 0.3 task/s, elapsed: 429s, ETA:  1026s[>>>>>>>>                     ] 119/400, 0.3 task/s, elapsed: 433s, ETA:  1022s[>>>>>>>>                     ] 120/400, 0.3 task/s, elapsed: 436s, ETA:  1018s[>>>>>>>>                     ] 121/400, 0.3 task/s, elapsed: 440s, ETA:  1015s[>>>>>>>>                     ] 122/400, 0.3 task/s, elapsed: 444s, ETA:  1011s[>>>>>>>>                     ] 123/400, 0.3 task/s, elapsed: 447s, ETA:  1007s[>>>>>>>>                     ] 124/400, 0.3 task/s, elapsed: 451s, ETA:  1004s[>>>>>>>>>                    ] 125/400, 0.3 task/s, elapsed: 455s, ETA:  1000s[>>>>>>>>>                    ] 126/400, 0.3 task/s, elapsed: 458s, ETA:   996s[>>>>>>>>>                    ] 127/400, 0.3 task/s, elapsed: 462s, ETA:   993s[>>>>>>>>>                    ] 128/400, 0.3 task/s, elapsed: 465s, ETA:   989s[>>>>>>>>>                    ] 129/400, 0.3 task/s, elapsed: 469s, ETA:   985s[>>>>>>>>>                    ] 130/400, 0.3 task/s, elapsed: 473s, ETA:   982s[>>>>>>>>>                    ] 131/400, 0.3 task/s, elapsed: 476s, ETA:   978s[>>>>>>>>>                    ] 132/400, 0.3 task/s, elapsed: 480s, ETA:   975s[>>>>>>>>>                    ] 133/400, 0.3 task/s, elapsed: 484s, ETA:   971s[>>>>>>>>>                    ] 134/400, 0.3 task/s, elapsed: 488s, ETA:   968s[>>>>>>>>>                    ] 135/400, 0.3 task/s, elapsed: 491s, ETA:   965s[>>>>>>>>>                    ] 136/400, 0.3 task/s, elapsed: 495s, ETA:   961s[>>>>>>>>>                    ] 137/400, 0.3 task/s, elapsed: 499s, ETA:   957s[>>>>>>>>>>                   ] 138/400, 0.3 task/s, elapsed: 502s, ETA:   954s[>>>>>>>>>>                   ] 139/400, 0.3 task/s, elapsed: 506s, ETA:   950s[>>>>>>>>>>                   ] 140/400, 0.3 task/s, elapsed: 510s, ETA:   946s[>>>>>>>>>>                   ] 141/400, 0.3 task/s, elapsed: 513s, ETA:   943s[>>>>>>>>>>                   ] 142/400, 0.3 task/s, elapsed: 517s, ETA:   939s[>>>>>>>>>>                   ] 143/400, 0.3 task/s, elapsed: 521s, ETA:   935s[>>>>>>>>>>                   ] 144/400, 0.3 task/s, elapsed: 524s, ETA:   932s[>>>>>>>>>>                   ] 145/400, 0.3 task/s, elapsed: 528s, ETA:   928s[>>>>>>>>>>                   ] 146/400, 0.3 task/s, elapsed: 531s, ETA:   925s[>>>>>>>>>>                   ] 147/400, 0.3 task/s, elapsed: 535s, ETA:   921s[>>>>>>>>>>                   ] 148/400, 0.3 task/s, elapsed: 539s, ETA:   917s[>>>>>>>>>>                   ] 149/400, 0.3 task/s, elapsed: 542s, ETA:   914s[>>>>>>>>>>                   ] 150/400, 0.3 task/s, elapsed: 546s, ETA:   910s[>>>>>>>>>>                   ] 151/400, 0.3 task/s, elapsed: 550s, ETA:   906s[>>>>>>>>>>>                  ] 152/400, 0.3 task/s, elapsed: 553s, ETA:   903s[>>>>>>>>>>>                  ] 153/400, 0.3 task/s, elapsed: 557s, ETA:   899s[>>>>>>>>>>>                  ] 154/400, 0.3 task/s, elapsed: 560s, ETA:   895s[>>>>>>>>>>>                  ] 155/400, 0.3 task/s, elapsed: 564s, ETA:   892s[>>>>>>>>>>>                  ] 156/400, 0.3 task/s, elapsed: 568s, ETA:   888s[>>>>>>>>>>>                  ] 157/400, 0.3 task/s, elapsed: 571s, ETA:   884s[>>>>>>>>>>>                  ] 158/400, 0.3 task/s, elapsed: 575s, ETA:   881s[>>>>>>>>>>>                  ] 159/400, 0.3 task/s, elapsed: 579s, ETA:   877s[>>>>>>>>>>>                  ] 160/400, 0.3 task/s, elapsed: 582s, ETA:   873s[>>>>>>>>>>>                  ] 161/400, 0.3 task/s, elapsed: 586s, ETA:   870s[>>>>>>>>>>>                  ] 162/400, 0.3 task/s, elapsed: 589s, ETA:   866s[>>>>>>>>>>>                  ] 163/400, 0.3 task/s, elapsed: 593s, ETA:   862s[>>>>>>>>>>>                  ] 164/400, 0.3 task/s, elapsed: 597s, ETA:   859s[>>>>>>>>>>>                  ] 165/400, 0.3 task/s, elapsed: 600s, ETA:   855s[>>>>>>>>>>>>                 ] 166/400, 0.3 task/s, elapsed: 604s, ETA:   851s[>>>>>>>>>>>>                 ] 167/400, 0.3 task/s, elapsed: 608s, ETA:   848s[>>>>>>>>>>>>                 ] 168/400, 0.3 task/s, elapsed: 611s, ETA:   844s[>>>>>>>>>>>>                 ] 169/400, 0.3 task/s, elapsed: 615s, ETA:   840s[>>>>>>>>>>>>                 ] 170/400, 0.3 task/s, elapsed: 618s, ETA:   837s[>>>>>>>>>>>>                 ] 171/400, 0.3 task/s, elapsed: 622s, ETA:   833s[>>>>>>>>>>>>                 ] 172/400, 0.3 task/s, elapsed: 626s, ETA:   829s[>>>>>>>>>>>>                 ] 173/400, 0.3 task/s, elapsed: 629s, ETA:   826s[>>>>>>>>>>>>                 ] 174/400, 0.3 task/s, elapsed: 633s, ETA:   822s[>>>>>>>>>>>>                 ] 175/400, 0.3 task/s, elapsed: 637s, ETA:   818s[>>>>>>>>>>>>                 ] 176/400, 0.3 task/s, elapsed: 640s, ETA:   815s[>>>>>>>>>>>>                 ] 177/400, 0.3 task/s, elapsed: 644s, ETA:   811s[>>>>>>>>>>>>                 ] 178/400, 0.3 task/s, elapsed: 647s, ETA:   807s[>>>>>>>>>>>>                 ] 179/400, 0.3 task/s, elapsed: 651s, ETA:   804s[>>>>>>>>>>>>>                ] 180/400, 0.3 task/s, elapsed: 655s, ETA:   800s[>>>>>>>>>>>>>                ] 181/400, 0.3 task/s, elapsed: 658s, ETA:   797s[>>>>>>>>>>>>>                ] 182/400, 0.3 task/s, elapsed: 662s, ETA:   793s[>>>>>>>>>>>>>                ] 183/400, 0.3 task/s, elapsed: 666s, ETA:   789s[>>>>>>>>>>>>>                ] 184/400, 0.3 task/s, elapsed: 669s, ETA:   786s[>>>>>>>>>>>>>                ] 185/400, 0.3 task/s, elapsed: 673s, ETA:   782s[>>>>>>>>>>>>>                ] 186/400, 0.3 task/s, elapsed: 676s, ETA:   778s[>>>>>>>>>>>>>                ] 187/400, 0.3 task/s, elapsed: 680s, ETA:   775s[>>>>>>>>>>>>>                ] 188/400, 0.3 task/s, elapsed: 684s, ETA:   771s[>>>>>>>>>>>>>                ] 189/400, 0.3 task/s, elapsed: 687s, ETA:   767s[>>>>>>>>>>>>>                ] 190/400, 0.3 task/s, elapsed: 691s, ETA:   764s[>>>>>>>>>>>>>                ] 191/400, 0.3 task/s, elapsed: 695s, ETA:   760s[>>>>>>>>>>>>>                ] 192/400, 0.3 task/s, elapsed: 698s, ETA:   756s[>>>>>>>>>>>>>                ] 193/400, 0.3 task/s, elapsed: 702s, ETA:   753s[>>>>>>>>>>>>>>               ] 194/400, 0.3 task/s, elapsed: 705s, ETA:   749s[>>>>>>>>>>>>>>               ] 195/400, 0.3 task/s, elapsed: 709s, ETA:   745s[>>>>>>>>>>>>>>               ] 196/400, 0.3 task/s, elapsed: 713s, ETA:   742s[>>>>>>>>>>>>>>               ] 197/400, 0.3 task/s, elapsed: 716s, ETA:   738s[>>>>>>>>>>>>>>               ] 198/400, 0.3 task/s, elapsed: 720s, ETA:   734s[>>>>>>>>>>>>>>               ] 199/400, 0.3 task/s, elapsed: 724s, ETA:   731s[>>>>>>>>>>>>>>               ] 200/400, 0.3 task/s, elapsed: 727s, ETA:   727s[>>>>>>>>>>>>>>               ] 201/400, 0.3 task/s, elapsed: 731s, ETA:   723s[>>>>>>>>>>>>>>               ] 202/400, 0.3 task/s, elapsed: 734s, ETA:   720s[>>>>>>>>>>>>>>               ] 203/400, 0.3 task/s, elapsed: 738s, ETA:   716s[>>>>>>>>>>>>>>               ] 204/400, 0.3 task/s, elapsed: 742s, ETA:   713s[>>>>>>>>>>>>>>               ] 205/400, 0.3 task/s, elapsed: 745s, ETA:   709s[>>>>>>>>>>>>>>               ] 206/400, 0.3 task/s, elapsed: 749s, ETA:   705s[>>>>>>>>>>>>>>>              ] 207/400, 0.3 task/s, elapsed: 752s, ETA:   702s[>>>>>>>>>>>>>>>              ] 208/400, 0.3 task/s, elapsed: 756s, ETA:   698s[>>>>>>>>>>>>>>>              ] 209/400, 0.3 task/s, elapsed: 760s, ETA:   694s[>>>>>>>>>>>>>>>              ] 210/400, 0.3 task/s, elapsed: 763s, ETA:   691s[>>>>>>>>>>>>>>>              ] 211/400, 0.3 task/s, elapsed: 767s, ETA:   687s[>>>>>>>>>>>>>>>              ] 212/400, 0.3 task/s, elapsed: 771s, ETA:   683s[>>>>>>>>>>>>>>>              ] 213/400, 0.3 task/s, elapsed: 774s, ETA:   680s[>>>>>>>>>>>>>>>              ] 214/400, 0.3 task/s, elapsed: 778s, ETA:   676s[>>>>>>>>>>>>>>>              ] 215/400, 0.3 task/s, elapsed: 781s, ETA:   672s[>>>>>>>>>>>>>>>              ] 216/400, 0.3 task/s, elapsed: 785s, ETA:   669s[>>>>>>>>>>>>>>>              ] 217/400, 0.3 task/s, elapsed: 789s, ETA:   665s[>>>>>>>>>>>>>>>              ] 218/400, 0.3 task/s, elapsed: 792s, ETA:   661s[>>>>>>>>>>>>>>>              ] 219/400, 0.3 task/s, elapsed: 796s, ETA:   658s[>>>>>>>>>>>>>>>              ] 220/400, 0.3 task/s, elapsed: 800s, ETA:   654s[>>>>>>>>>>>>>>>>             ] 221/400, 0.3 task/s, elapsed: 803s, ETA:   651s[>>>>>>>>>>>>>>>>             ] 222/400, 0.3 task/s, elapsed: 807s, ETA:   647s[>>>>>>>>>>>>>>>>             ] 223/400, 0.3 task/s, elapsed: 810s, ETA:   643s[>>>>>>>>>>>>>>>>             ] 224/400, 0.3 task/s, elapsed: 814s, ETA:   640s[>>>>>>>>>>>>>>>>             ] 225/400, 0.3 task/s, elapsed: 818s, ETA:   636s[>>>>>>>>>>>>>>>>             ] 226/400, 0.3 task/s, elapsed: 821s, ETA:   632s[>>>>>>>>>>>>>>>>             ] 227/400, 0.3 task/s, elapsed: 825s, ETA:   629s[>>>>>>>>>>>>>>>>             ] 228/400, 0.3 task/s, elapsed: 829s, ETA:   625s[>>>>>>>>>>>>>>>>             ] 229/400, 0.3 task/s, elapsed: 832s, ETA:   621s[>>>>>>>>>>>>>>>>             ] 230/400, 0.3 task/s, elapsed: 836s, ETA:   618s[>>>>>>>>>>>>>>>>             ] 231/400, 0.3 task/s, elapsed: 839s, ETA:   614s[>>>>>>>>>>>>>>>>             ] 232/400, 0.3 task/s, elapsed: 843s, ETA:   610s[>>>>>>>>>>>>>>>>             ] 233/400, 0.3 task/s, elapsed: 847s, ETA:   607s[>>>>>>>>>>>>>>>>             ] 234/400, 0.3 task/s, elapsed: 850s, ETA:   603s[>>>>>>>>>>>>>>>>>            ] 235/400, 0.3 task/s, elapsed: 854s, ETA:   600s[>>>>>>>>>>>>>>>>>            ] 236/400, 0.3 task/s, elapsed: 858s, ETA:   596s[>>>>>>>>>>>>>>>>>            ] 237/400, 0.3 task/s, elapsed: 861s, ETA:   592s[>>>>>>>>>>>>>>>>>            ] 238/400, 0.3 task/s, elapsed: 865s, ETA:   589s[>>>>>>>>>>>>>>>>>            ] 239/400, 0.3 task/s, elapsed: 868s, ETA:   585s[>>>>>>>>>>>>>>>>>            ] 240/400, 0.3 task/s, elapsed: 872s, ETA:   581s[>>>>>>>>>>>>>>>>>            ] 241/400, 0.3 task/s, elapsed: 876s, ETA:   578s[>>>>>>>>>>>>>>>>>            ] 242/400, 0.3 task/s, elapsed: 879s, ETA:   574s[>>>>>>>>>>>>>>>>>            ] 243/400, 0.3 task/s, elapsed: 883s, ETA:   570s[>>>>>>>>>>>>>>>>>            ] 244/400, 0.3 task/s, elapsed: 887s, ETA:   567s[>>>>>>>>>>>>>>>>>            ] 245/400, 0.3 task/s, elapsed: 890s, ETA:   563s[>>>>>>>>>>>>>>>>>            ] 246/400, 0.3 task/s, elapsed: 894s, ETA:   560s[>>>>>>>>>>>>>>>>>            ] 247/400, 0.3 task/s, elapsed: 897s, ETA:   556s[>>>>>>>>>>>>>>>>>            ] 248/400, 0.3 task/s, elapsed: 901s, ETA:   552s[>>>>>>>>>>>>>>>>>>           ] 249/400, 0.3 task/s, elapsed: 905s, ETA:   549s[>>>>>>>>>>>>>>>>>>           ] 250/400, 0.3 task/s, elapsed: 908s, ETA:   545s[>>>>>>>>>>>>>>>>>>           ] 251/400, 0.3 task/s, elapsed: 912s, ETA:   541s[>>>>>>>>>>>>>>>>>>           ] 252/400, 0.3 task/s, elapsed: 916s, ETA:   538s[>>>>>>>>>>>>>>>>>>           ] 253/400, 0.3 task/s, elapsed: 919s, ETA:   534s[>>>>>>>>>>>>>>>>>>           ] 254/400, 0.3 task/s, elapsed: 923s, ETA:   530s[>>>>>>>>>>>>>>>>>>           ] 255/400, 0.3 task/s, elapsed: 926s, ETA:   527s[>>>>>>>>>>>>>>>>>>           ] 256/400, 0.3 task/s, elapsed: 930s, ETA:   523s[>>>>>>>>>>>>>>>>>>           ] 257/400, 0.3 task/s, elapsed: 934s, ETA:   519s[>>>>>>>>>>>>>>>>>>           ] 258/400, 0.3 task/s, elapsed: 937s, ETA:   516s[>>>>>>>>>>>>>>>>>>           ] 259/400, 0.3 task/s, elapsed: 941s, ETA:   512s[>>>>>>>>>>>>>>>>>>           ] 260/400, 0.3 task/s, elapsed: 944s, ETA:   509s[>>>>>>>>>>>>>>>>>>           ] 261/400, 0.3 task/s, elapsed: 948s, ETA:   505s[>>>>>>>>>>>>>>>>>>           ] 262/400, 0.3 task/s, elapsed: 952s, ETA:   501s[>>>>>>>>>>>>>>>>>>>          ] 263/400, 0.3 task/s, elapsed: 955s, ETA:   498s[>>>>>>>>>>>>>>>>>>>          ] 264/400, 0.3 task/s, elapsed: 959s, ETA:   494s[>>>>>>>>>>>>>>>>>>>          ] 265/400, 0.3 task/s, elapsed: 963s, ETA:   490s[>>>>>>>>>>>>>>>>>>>          ] 266/400, 0.3 task/s, elapsed: 966s, ETA:   487s[>>>>>>>>>>>>>>>>>>>          ] 267/400, 0.3 task/s, elapsed: 970s, ETA:   483s[>>>>>>>>>>>>>>>>>>>          ] 268/400, 0.3 task/s, elapsed: 973s, ETA:   479s[>>>>>>>>>>>>>>>>>>>          ] 269/400, 0.3 task/s, elapsed: 977s, ETA:   476s[>>>>>>>>>>>>>>>>>>>          ] 270/400, 0.3 task/s, elapsed: 981s, ETA:   472s[>>>>>>>>>>>>>>>>>>>          ] 271/400, 0.3 task/s, elapsed: 984s, ETA:   469s[>>>>>>>>>>>>>>>>>>>          ] 272/400, 0.3 task/s, elapsed: 988s, ETA:   465s[>>>>>>>>>>>>>>>>>>>          ] 273/400, 0.3 task/s, elapsed: 992s, ETA:   461s[>>>>>>>>>>>>>>>>>>>          ] 274/400, 0.3 task/s, elapsed: 995s, ETA:   458s[>>>>>>>>>>>>>>>>>>>          ] 275/400, 0.3 task/s, elapsed: 999s, ETA:   454s[>>>>>>>>>>>>>>>>>>>         ] 276/400, 0.3 task/s, elapsed: 1002s, ETA:   450s[>>>>>>>>>>>>>>>>>>>         ] 277/400, 0.3 task/s, elapsed: 1006s, ETA:   447s[>>>>>>>>>>>>>>>>>>>         ] 278/400, 0.3 task/s, elapsed: 1010s, ETA:   443s[>>>>>>>>>>>>>>>>>>>         ] 279/400, 0.3 task/s, elapsed: 1013s, ETA:   439s[>>>>>>>>>>>>>>>>>>>         ] 280/400, 0.3 task/s, elapsed: 1017s, ETA:   436s[>>>>>>>>>>>>>>>>>>>         ] 281/400, 0.3 task/s, elapsed: 1021s, ETA:   432s[>>>>>>>>>>>>>>>>>>>         ] 282/400, 0.3 task/s, elapsed: 1024s, ETA:   429s[>>>>>>>>>>>>>>>>>>>         ] 283/400, 0.3 task/s, elapsed: 1028s, ETA:   425s[>>>>>>>>>>>>>>>>>>>         ] 284/400, 0.3 task/s, elapsed: 1031s, ETA:   421s[>>>>>>>>>>>>>>>>>>>         ] 285/400, 0.3 task/s, elapsed: 1035s, ETA:   418s[>>>>>>>>>>>>>>>>>>>>        ] 286/400, 0.3 task/s, elapsed: 1039s, ETA:   414s[>>>>>>>>>>>>>>>>>>>>        ] 287/400, 0.3 task/s, elapsed: 1042s, ETA:   410s[>>>>>>>>>>>>>>>>>>>>        ] 288/400, 0.3 task/s, elapsed: 1046s, ETA:   407s[>>>>>>>>>>>>>>>>>>>>        ] 289/400, 0.3 task/s, elapsed: 1050s, ETA:   403s[>>>>>>>>>>>>>>>>>>>>        ] 290/400, 0.3 task/s, elapsed: 1053s, ETA:   399s[>>>>>>>>>>>>>>>>>>>>        ] 291/400, 0.3 task/s, elapsed: 1057s, ETA:   396s[>>>>>>>>>>>>>>>>>>>>        ] 292/400, 0.3 task/s, elapsed: 1060s, ETA:   392s[>>>>>>>>>>>>>>>>>>>>        ] 293/400, 0.3 task/s, elapsed: 1064s, ETA:   389s[>>>>>>>>>>>>>>>>>>>>        ] 294/400, 0.3 task/s, elapsed: 1068s, ETA:   385s[>>>>>>>>>>>>>>>>>>>>        ] 295/400, 0.3 task/s, elapsed: 1071s, ETA:   381s[>>>>>>>>>>>>>>>>>>>>        ] 296/400, 0.3 task/s, elapsed: 1075s, ETA:   378s[>>>>>>>>>>>>>>>>>>>>        ] 297/400, 0.3 task/s, elapsed: 1078s, ETA:   374s[>>>>>>>>>>>>>>>>>>>>        ] 298/400, 0.3 task/s, elapsed: 1082s, ETA:   370s[>>>>>>>>>>>>>>>>>>>>        ] 299/400, 0.3 task/s, elapsed: 1086s, ETA:   367s[>>>>>>>>>>>>>>>>>>>>>       ] 300/400, 0.3 task/s, elapsed: 1089s, ETA:   363s[>>>>>>>>>>>>>>>>>>>>>       ] 301/400, 0.3 task/s, elapsed: 1093s, ETA:   359s[>>>>>>>>>>>>>>>>>>>>>       ] 302/400, 0.3 task/s, elapsed: 1097s, ETA:   356s[>>>>>>>>>>>>>>>>>>>>>       ] 303/400, 0.3 task/s, elapsed: 1100s, ETA:   352s[>>>>>>>>>>>>>>>>>>>>>       ] 304/400, 0.3 task/s, elapsed: 1104s, ETA:   349s[>>>>>>>>>>>>>>>>>>>>>       ] 305/400, 0.3 task/s, elapsed: 1107s, ETA:   345s[>>>>>>>>>>>>>>>>>>>>>       ] 306/400, 0.3 task/s, elapsed: 1111s, ETA:   341s[>>>>>>>>>>>>>>>>>>>>>       ] 307/400, 0.3 task/s, elapsed: 1115s, ETA:   338s[>>>>>>>>>>>>>>>>>>>>>       ] 308/400, 0.3 task/s, elapsed: 1118s, ETA:   334s[>>>>>>>>>>>>>>>>>>>>>       ] 309/400, 0.3 task/s, elapsed: 1122s, ETA:   330s[>>>>>>>>>>>>>>>>>>>>>       ] 310/400, 0.3 task/s, elapsed: 1126s, ETA:   327s[>>>>>>>>>>>>>>>>>>>>>       ] 311/400, 0.3 task/s, elapsed: 1129s, ETA:   323s[>>>>>>>>>>>>>>>>>>>>>       ] 312/400, 0.3 task/s, elapsed: 1133s, ETA:   320s[>>>>>>>>>>>>>>>>>>>>>       ] 313/400, 0.3 task/s, elapsed: 1136s, ETA:   316s[>>>>>>>>>>>>>>>>>>>>>       ] 314/400, 0.3 task/s, elapsed: 1140s, ETA:   312s[>>>>>>>>>>>>>>>>>>>>>>      ] 315/400, 0.3 task/s, elapsed: 1144s, ETA:   309s[>>>>>>>>>>>>>>>>>>>>>>      ] 316/400, 0.3 task/s, elapsed: 1147s, ETA:   305s[>>>>>>>>>>>>>>>>>>>>>>      ] 317/400, 0.3 task/s, elapsed: 1151s, ETA:   301s[>>>>>>>>>>>>>>>>>>>>>>      ] 318/400, 0.3 task/s, elapsed: 1155s, ETA:   298s[>>>>>>>>>>>>>>>>>>>>>>      ] 319/400, 0.3 task/s, elapsed: 1158s, ETA:   294s[>>>>>>>>>>>>>>>>>>>>>>      ] 320/400, 0.3 task/s, elapsed: 1162s, ETA:   290s[>>>>>>>>>>>>>>>>>>>>>>      ] 321/400, 0.3 task/s, elapsed: 1165s, ETA:   287s[>>>>>>>>>>>>>>>>>>>>>>      ] 322/400, 0.3 task/s, elapsed: 1169s, ETA:   283s[>>>>>>>>>>>>>>>>>>>>>>      ] 323/400, 0.3 task/s, elapsed: 1173s, ETA:   280s[>>>>>>>>>>>>>>>>>>>>>>      ] 324/400, 0.3 task/s, elapsed: 1177s, ETA:   276s[>>>>>>>>>>>>>>>>>>>>>>      ] 325/400, 0.3 task/s, elapsed: 1180s, ETA:   272s[>>>>>>>>>>>>>>>>>>>>>>      ] 326/400, 0.3 task/s, elapsed: 1184s, ETA:   269s[>>>>>>>>>>>>>>>>>>>>>>      ] 327/400, 0.3 task/s, elapsed: 1188s, ETA:   265s[>>>>>>>>>>>>>>>>>>>>>>      ] 328/400, 0.3 task/s, elapsed: 1191s, ETA:   262s[>>>>>>>>>>>>>>>>>>>>>>>     ] 329/400, 0.3 task/s, elapsed: 1195s, ETA:   258s[>>>>>>>>>>>>>>>>>>>>>>>     ] 330/400, 0.3 task/s, elapsed: 1199s, ETA:   254s[>>>>>>>>>>>>>>>>>>>>>>>     ] 331/400, 0.3 task/s, elapsed: 1202s, ETA:   251s[>>>>>>>>>>>>>>>>>>>>>>>     ] 332/400, 0.3 task/s, elapsed: 1206s, ETA:   247s[>>>>>>>>>>>>>>>>>>>>>>>     ] 333/400, 0.3 task/s, elapsed: 1210s, ETA:   243s[>>>>>>>>>>>>>>>>>>>>>>>     ] 334/400, 0.3 task/s, elapsed: 1214s, ETA:   240s[>>>>>>>>>>>>>>>>>>>>>>>     ] 335/400, 0.3 task/s, elapsed: 1217s, ETA:   236s[>>>>>>>>>>>>>>>>>>>>>>>     ] 336/400, 0.3 task/s, elapsed: 1221s, ETA:   233s[>>>>>>>>>>>>>>>>>>>>>>>     ] 337/400, 0.3 task/s, elapsed: 1225s, ETA:   229s[>>>>>>>>>>>>>>>>>>>>>>>     ] 338/400, 0.3 task/s, elapsed: 1228s, ETA:   225s[>>>>>>>>>>>>>>>>>>>>>>>     ] 339/400, 0.3 task/s, elapsed: 1232s, ETA:   222s[>>>>>>>>>>>>>>>>>>>>>>>     ] 340/400, 0.3 task/s, elapsed: 1236s, ETA:   218s[>>>>>>>>>>>>>>>>>>>>>>>     ] 341/400, 0.3 task/s, elapsed: 1240s, ETA:   214s[>>>>>>>>>>>>>>>>>>>>>>>     ] 342/400, 0.3 task/s, elapsed: 1243s, ETA:   211s[>>>>>>>>>>>>>>>>>>>>>>>>    ] 343/400, 0.3 task/s, elapsed: 1247s, ETA:   207s[>>>>>>>>>>>>>>>>>>>>>>>>    ] 344/400, 0.3 task/s, elapsed: 1251s, ETA:   204s[>>>>>>>>>>>>>>>>>>>>>>>>    ] 345/400, 0.3 task/s, elapsed: 1254s, ETA:   200s[>>>>>>>>>>>>>>>>>>>>>>>>    ] 346/400, 0.3 task/s, elapsed: 1258s, ETA:   196s[>>>>>>>>>>>>>>>>>>>>>>>>    ] 347/400, 0.3 task/s, elapsed: 1262s, ETA:   193s[>>>>>>>>>>>>>>>>>>>>>>>>    ] 348/400, 0.3 task/s, elapsed: 1265s, ETA:   189s[>>>>>>>>>>>>>>>>>>>>>>>>    ] 349/400, 0.3 task/s, elapsed: 1269s, ETA:   185s[>>>>>>>>>>>>>>>>>>>>>>>>    ] 350/400, 0.3 task/s, elapsed: 1273s, ETA:   182s[>>>>>>>>>>>>>>>>>>>>>>>>    ] 351/400, 0.3 task/s, elapsed: 1277s, ETA:   178s[>>>>>>>>>>>>>>>>>>>>>>>>    ] 352/400, 0.3 task/s, elapsed: 1280s, ETA:   175s[>>>>>>>>>>>>>>>>>>>>>>>>    ] 353/400, 0.3 task/s, elapsed: 1284s, ETA:   171s[>>>>>>>>>>>>>>>>>>>>>>>>    ] 354/400, 0.3 task/s, elapsed: 1288s, ETA:   167s[>>>>>>>>>>>>>>>>>>>>>>>>    ] 355/400, 0.3 task/s, elapsed: 1291s, ETA:   164s[>>>>>>>>>>>>>>>>>>>>>>>>    ] 356/400, 0.3 task/s, elapsed: 1295s, ETA:   160s[>>>>>>>>>>>>>>>>>>>>>>>>    ] 357/400, 0.3 task/s, elapsed: 1299s, ETA:   156s[>>>>>>>>>>>>>>>>>>>>>>>>>   ] 358/400, 0.3 task/s, elapsed: 1303s, ETA:   153s[>>>>>>>>>>>>>>>>>>>>>>>>>   ] 359/400, 0.3 task/s, elapsed: 1306s, ETA:   149s[>>>>>>>>>>>>>>>>>>>>>>>>>   ] 360/400, 0.3 task/s, elapsed: 1310s, ETA:   146s[>>>>>>>>>>>>>>>>>>>>>>>>>   ] 361/400, 0.3 task/s, elapsed: 1314s, ETA:   142s[>>>>>>>>>>>>>>>>>>>>>>>>>   ] 362/400, 0.3 task/s, elapsed: 1317s, ETA:   138s[>>>>>>>>>>>>>>>>>>>>>>>>>   ] 363/400, 0.3 task/s, elapsed: 1321s, ETA:   135s[>>>>>>>>>>>>>>>>>>>>>>>>>   ] 364/400, 0.3 task/s, elapsed: 1325s, ETA:   131s[>>>>>>>>>>>>>>>>>>>>>>>>>   ] 365/400, 0.3 task/s, elapsed: 1328s, ETA:   127s[>>>>>>>>>>>>>>>>>>>>>>>>>   ] 366/400, 0.3 task/s, elapsed: 1332s, ETA:   124s[>>>>>>>>>>>>>>>>>>>>>>>>>   ] 367/400, 0.3 task/s, elapsed: 1336s, ETA:   120s[>>>>>>>>>>>>>>>>>>>>>>>>>   ] 368/400, 0.3 task/s, elapsed: 1340s, ETA:   116s[>>>>>>>>>>>>>>>>>>>>>>>>>   ] 369/400, 0.3 task/s, elapsed: 1343s, ETA:   113s[>>>>>>>>>>>>>>>>>>>>>>>>>   ] 370/400, 0.3 task/s, elapsed: 1347s, ETA:   109s[>>>>>>>>>>>>>>>>>>>>>>>>>   ] 371/400, 0.3 task/s, elapsed: 1351s, ETA:   106s[>>>>>>>>>>>>>>>>>>>>>>>>>>  ] 372/400, 0.3 task/s, elapsed: 1354s, ETA:   102s[>>>>>>>>>>>>>>>>>>>>>>>>>>  ] 373/400, 0.3 task/s, elapsed: 1358s, ETA:    98s[>>>>>>>>>>>>>>>>>>>>>>>>>>  ] 374/400, 0.3 task/s, elapsed: 1362s, ETA:    95s[>>>>>>>>>>>>>>>>>>>>>>>>>>  ] 375/400, 0.3 task/s, elapsed: 1366s, ETA:    91s[>>>>>>>>>>>>>>>>>>>>>>>>>>  ] 376/400, 0.3 task/s, elapsed: 1369s, ETA:    87s[>>>>>>>>>>>>>>>>>>>>>>>>>>  ] 377/400, 0.3 task/s, elapsed: 1373s, ETA:    84s[>>>>>>>>>>>>>>>>>>>>>>>>>>  ] 378/400, 0.3 task/s, elapsed: 1377s, ETA:    80s[>>>>>>>>>>>>>>>>>>>>>>>>>>  ] 379/400, 0.3 task/s, elapsed: 1380s, ETA:    76s[>>>>>>>>>>>>>>>>>>>>>>>>>>  ] 380/400, 0.3 task/s, elapsed: 1384s, ETA:    73s[>>>>>>>>>>>>>>>>>>>>>>>>>>  ] 381/400, 0.3 task/s, elapsed: 1388s, ETA:    69s[>>>>>>>>>>>>>>>>>>>>>>>>>>  ] 382/400, 0.3 task/s, elapsed: 1391s, ETA:    66s[>>>>>>>>>>>>>>>>>>>>>>>>>>  ] 383/400, 0.3 task/s, elapsed: 1395s, ETA:    62s[>>>>>>>>>>>>>>>>>>>>>>>>>>  ] 384/400, 0.3 task/s, elapsed: 1399s, ETA:    58s[>>>>>>>>>>>>>>>>>>>>>>>>>>  ] 385/400, 0.3 task/s, elapsed: 1403s, ETA:    55s[>>>>>>>>>>>>>>>>>>>>>>>>>>> ] 386/400, 0.3 task/s, elapsed: 1406s, ETA:    51s[>>>>>>>>>>>>>>>>>>>>>>>>>>> ] 387/400, 0.3 task/s, elapsed: 1410s, ETA:    47s[>>>>>>>>>>>>>>>>>>>>>>>>>>> ] 388/400, 0.3 task/s, elapsed: 1414s, ETA:    44s[>>>>>>>>>>>>>>>>>>>>>>>>>>> ] 389/400, 0.3 task/s, elapsed: 1417s, ETA:    40s[>>>>>>>>>>>>>>>>>>>>>>>>>>> ] 390/400, 0.3 task/s, elapsed: 1421s, ETA:    36s[>>>>>>>>>>>>>>>>>>>>>>>>>>> ] 391/400, 0.3 task/s, elapsed: 1425s, ETA:    33s[>>>>>>>>>>>>>>>>>>>>>>>>>>> ] 392/400, 0.3 task/s, elapsed: 1429s, ETA:    29s[>>>>>>>>>>>>>>>>>>>>>>>>>>> ] 393/400, 0.3 task/s, elapsed: 1432s, ETA:    26s[>>>>>>>>>>>>>>>>>>>>>>>>>>> ] 394/400, 0.3 task/s, elapsed: 1436s, ETA:    22s[>>>>>>>>>>>>>>>>>>>>>>>>>>> ] 395/400, 0.3 task/s, elapsed: 1440s, ETA:    18s[>>>>>>>>>>>>>>>>>>>>>>>>>>> ] 396/400, 0.3 task/s, elapsed: 1443s, ETA:    15s[>>>>>>>>>>>>>>>>>>>>>>>>>>> ] 397/400, 0.3 task/s, elapsed: 1447s, ETA:    11s[>>>>>>>>>>>>>>>>>>>>>>>>>>> ] 398/400, 0.3 task/s, elapsed: 1451s, ETA:     7s[>>>>>>>>>>>>>>>>>>>>>>>>>>> ] 399/400, 0.3 task/s, elapsed: 1454s, ETA:     4s[>>>>>>>>>>>>>>>>>>>>>>>>>>>>] 400/400, 0.3 task/s, elapsed: 1458s, ETA:     0s
writing results to work_dirs/res.pkl
per class results:

+---------------+-------+-------+
| Class         | IoU   | Acc   |
+---------------+-------+-------+
| road          | 88.68 | 98.93 |
| sidewalk      | 51.96 | 58.48 |
| building      | 64.04 | 90.43 |
| wall          | 27.93 | 35.66 |
| fence         | 24.28 | 26.71 |
| pole          | 45.63 | 54.38 |
| traffic light | 44.83 | 56.1  |
| traffic sign  | 40.57 | 43.93 |
| vegetation    | 44.68 | 84.77 |
| terrain       | 25.84 | 61.0  |
| sky           | 5.61  | 5.61  |
| person        | 52.63 | 75.79 |
| rider         | 43.94 | 55.98 |
| car           | 76.53 | 88.04 |
| truck         | 24.02 | 60.46 |
| bus           | 24.64 | 25.11 |
| train         | 50.28 | 55.8  |
| motorcycle    | 28.93 | 30.99 |
| bicycle       | 30.94 | 37.76 |
+---------------+-------+-------+
Summary:

+--------+-------+-------+-------+
| Scope  | mIoU  | mAcc  | aAcc  |
+--------+-------+-------+-------+
| global | 41.89 | 55.05 | 72.99 |
+--------+-------+-------+-------+
Logged mIoU: 0.4189
>>>>>>>>init mit_b5_sparse_prompt 0.0001
load checkpoint from local path: /gpfs/data/fs72306/leijx0408/SVDP/segformer.b5.1024x1024.city.160k.pth
The model and loaded state dict do not match exactly

missing keys in source state_dict: backbone.prompt.patch, backbone.prompt.feature_prompts.0

[                                                  ] 0/400, elapsed: 0s, ETA:[                                 ] 1/400, 0.2 task/s, elapsed: 4s, ETA:  1790s[                                 ] 2/400, 0.2 task/s, elapsed: 8s, ETA:  1610s[                                ] 3/400, 0.3 task/s, elapsed: 12s, ETA:  1547s[                                ] 4/400, 0.3 task/s, elapsed: 15s, ETA:  1512s[                                ] 5/400, 0.3 task/s, elapsed: 19s, ETA:  1492s[                                ] 6/400, 0.3 task/s, elapsed: 22s, ETA:  1476s[                                ] 7/400, 0.3 task/s, elapsed: 26s, ETA:  1464s[                                ] 8/400, 0.3 task/s, elapsed: 30s, ETA:  1454s[                                ] 9/400, 0.3 task/s, elapsed: 33s, ETA:  1446s[                               ] 10/400, 0.3 task/s, elapsed: 37s, ETA:  1439s[                               ] 11/400, 0.3 task/s, elapsed: 40s, ETA:  1432s[                               ] 12/400, 0.3 task/s, elapsed: 44s, ETA:  1426s[>                              ] 13/400, 0.3 task/s, elapsed: 48s, ETA:  1420s[>                              ] 14/400, 0.3 task/s, elapsed: 51s, ETA:  1417s[>                              ] 15/400, 0.3 task/s, elapsed: 55s, ETA:  1412s[>                              ] 16/400, 0.3 task/s, elapsed: 59s, ETA:  1407s[>                              ] 17/400, 0.3 task/s, elapsed: 62s, ETA:  1402s[>                              ] 18/400, 0.3 task/s, elapsed: 66s, ETA:  1397s[>                              ] 19/400, 0.3 task/s, elapsed: 69s, ETA:  1393s[>                              ] 20/400, 0.3 task/s, elapsed: 73s, ETA:  1388s[>                              ] 21/400, 0.3 task/s, elapsed: 77s, ETA:  1383s[>                              ] 22/400, 0.3 task/s, elapsed: 80s, ETA:  1378s[>                              ] 23/400, 0.3 task/s, elapsed: 84s, ETA:  1374s